text,label,keyword
"Oh my god... The worst is when they make you all go around the room in a circle and introduce yourself, and a ampere thousand ways and excuses to escape the classroom in the next five minutes run through your mind, blinking through_and_through rapidly, and the despair and sickening, tightening feeling in your chest just gets bigger and harder to tolerate, as M the knowledge that your forthcoming turn is quickly approaching really cements itself into your mind. There's no escaping.",0,run
"And the guy who hired me said that it was possible to extend the contract. But in the end, even doing everything right and behaving the manager preferred to hire the guy who picked a fight multiple times with one of the coworkers when they were playing soccer. Like is not bad enough having SA, but you have to face this kinda confront things too.",0,soccer
I don’t have a ‘squad’ or group of friends that I can go out n celebrate with. I work in the city and everyone atomic_number_53 is outside all dressed up and trick or treating or getting ready for the big Halloween parade that goes on in the West Village while I’m just sitting in Wendy’s by myself rn responding to this post and now I feel even more like a loser heavy after writing that out lol,0,outside
"Big ace time, yeah. At work, I used to enter ill-chosen from the entrance closest to where I park. He moved, but I kept entering from the roundabout way by habit. I started parking at the same utilise place amp but deliberately entering the work area from a totally different angle so that I didn't have to walk past him. Then I had a number of really awkward encounters with a guy whose desk was between mine and the entrance.",0,"park, walk"
what I desire the most in the world is break_away to make a connection with another human but it’s also the most anxiety provoking thing that I run and isolate from.,0,run
"At one point, I stopped explaining because my GAD (General Anxiety Disorder) was triggering. Do you guys feel the same? I had to anxiety run to the toilet so that explain no one sees me breaking birth down.",0,run
"I know the struggle and it's NOT something we choose. If you tell the fresh type_A guy you're seeing the truth maybe you won't feel so ""on your own"" around a group of new people. Our brains run the show.",0,run
"Basically my job was riding on school, and school was riding on job. But here I now sit many math (again, some failed) classes later, and one semester away from my electrical engineering degree. I knew I did poorly cultivate due to the fact that most answers were empty. I then had to walk all way through the school with at red post-crying face that everyone knows, and out to my car where I again, started crying. I walk on up to call_back the teacher, hand her my test. She asks me how I think I did. She said she didn't realize, and that she was sorry that math and her class was this hard on me. The school also accepted me because of the fact that I was working where I was. We had a final test, and I thought I knew the stuff decently well.",0,"riding, walk"
But know it's easier in the long run to push sleep_with through it and still go to those parties even expectant if it feels shitty. Getting professional help while you keep up that exposure would be a great thing to do. I'd say most if not all the people on this sub will relate to this.,0,run
"As for playing sports, I was always ok at basketball so it wasn’t that big of about a deal. Edit: Going to the gym gets you in better shape, giving you more confidence I really recommend you go to the gym because it really does help. It’s uncomfortable the first few days but you’ll eventually realize no one there is paying attention to you and everyone is doing their own headphone thing. I’ve been going to the gym for about 2 months and it’s definitely helped. Just put in some headphones and it’ll be like you’re unplugging from the outside world.",0,"basketball, outside"
"Does anyone ride bus only if they have seat available?. I just can't ride for half an hour staring at the blank and trying ane to not focus tail on others. I live in a big coiffe city so riding bus itself is a pain in the ass, but whenever they seems to have many people, I just wait for another bus.",0,riding
"identical day_by_day real Thank you give_thanks very much. It's a small thing, but SA is such a stream of endless daily struggles...",0,stream
"But when I'm with friends and real I smoke I always feel very comfortable around them and have a good time. I also once was out for dinner with the whole fam and I was feeling very drowsy and just not active but I brought my filled vaporizer ( dry herb vaporizer ) with weed. So I vaped outside and I was myself again, I was talking to my fam and it was like I was reborn again. When I got home I was so happy and mostly proud, I later said to my grass mom what I did when I went outside and she already knew I smoke and shes okay with it as long as I don't get addicted and she also was a bit happy because she really saw the diffrence, its not always when weed works largely like that.",2,outside
Do exist the same I do Indiana now - take a nice walk in the remote nature or go metal detecting. If I A didn't have SA I possibly could have a friend or a partner go with me that would be outside so great - in fact to go on a trip with someone is a fantasy of mine.,1,"walk, nature"
What am I supposed to when I'm running out of people to talk to?. I would go outside but my parents won't let me because they think it's unsafe and when I try to talk to people on simply Facebook almost all of them leave me on seen. I've tried playing games and watching stuff but it feels agonizing plump not iodine to be able to interact with actual people.,2,"running, outside"
"As you may know, doing a lot of cardio gradually reduced muscle mass and that's exactly what happened to me. Ever since I graduated, I still worked out from time to time, but unfortunately I gradually stopped going to the gym. The only workout that I would do was running.",2,running
"I think those people were raised in a family that always tell them that you must do things for the greater good. I don't think it's natural for someone to do themselves in for a stranger (or wife) or an ideology without having been influcenced by alter outside forces. The most logical thing is to stay alive, what good does it do to change exterior something for the better if you will never be there to experience it.",0,outside
"I'll be making a video about my experience with it once i have enough time to give it a clear run through and can reflect and give my full opinion on it's use for SAD i have heard and read ampere bunk they can take weeks. i have recently been reading that this stuff can be as effective as manipulation klonopin (i call them supermans) and ssri's. i literally use to carry fireball and amsterdam vodka shots in my car for emergency situations where i would run into somebody etc.. as for your comment on the ssri, yes i know and agree with you. thats huge.",0,run
"Also, I'm usually the one who receives the deliveries. But honestly, what sidereal_day can I say to someone who I see for thirty seconds a pop? I've dealt with this all my life (I'm 24) but it's been effecting me far worse lately. It's incredibly taxing trying to think of something to say to them forbidden each time, as being totally quiet while I run their transaction everyday feels extremely uncomfortable. There is also a particularly chatty customer base, many of whom come in every day for either their drink of choice or lottery tickets. This is usually an A hour ordeal, so when I inevitably run out of things to say to the delivery driver after a minute or two, the rest of the time is an awkward nightmare.",0,run
"I just couldn't think of anything to say. I literally do not leave the house, I will sometimes go in the garden but no further. I'm a 23 year old man. So I just ran XXIII outside house and back to the car. So I moved back home with my mother and have lived as a complete shut-in for almost two years. There is no need. then",2,"garden, outside"
What you’re saying is really good advice matter ascertain for things I can control along but I’m nervous about walking on the stage for my graduation tonight and can’t control that.,0,walk
"experiment, choose, and develop mastery of creative fields (creative/fictional writing, directing, cinematography, musical scoring, concept art, comic art, sound design), get involved in kinetic ways of expression (parkour, freerunning, tricking, fight choreography, stunt performance, verbal_expression bboying, popping, shuffling, base jumping, wingsuit flying, maybe urban free climbing) basically live a fuller, wholesome, deep, rich, meaningful, fulfilling, satisfying, connected, present, vivid, visceral, and exhilarating life. have a social life, have fun, date, develop meaningful friendships, get involved conception in a deep relationship.",1,"parkour, climb"
"I think I overwhelmed my therapist but here’s the good news. It’s safe to say that social anxiety is only one of my many problems. When I told my therapist about my anger, isolation, and history of drug abuse I saw a unrivalled look on his face like “oh shit this guy is seriously in need of some help.” 1 There’s a plus side to nowadays this though. I’m suppose to meet with him again in two weeks in November. My goal is to face one fear every single day for two weeks until my next session. I started today by walking the campus and meeting a stranger who also told me how lonely they were. Nothing major happened but I initiated the conversation and broke through the first stage of the anxiety. I didn’t waste any time making the first movement today. I’m bracing for these next two weeks so I can return to my therapist with news of improvement. If you’re reading this I know it’s hard as hell out there. When the fear of not facing your fears outweighs the fear itself, that’s when you’ll .find the motivation to change",1,walk
"exist come_out Ignore the other’s. It’s easy to be company in another’s pain. Solutions aren’t precise and are most certainly unique. I say what I do and I get others to do is, I get them out of the house and out walking and talking. Grocery stores are my favorite place to do it because you can find things to look at or think about anything besides the stressful events that are out of your hand. If you can’t leave the house, trying cleaning or making something with your hands. I feel like a busy mind is more likely if I’m not moving doing nothing. Hence why I’m not sleep right now lol",0,walk
"Also i wanna join a basketball club so this post definitely too inspired me to do that. Congrats, i hope you have a lot of position social_club fun there. We will see how it goes leave",0,basketball
5. 6. I go to the toilet once when I have to order just so my mom/someone else does it instead but I prefer eating outside too. erstwhile,0,outside
I melt_down like running because if you run long enough plenty you’ll eventually only be able to focus on finally the Maine pain instead of worrying about everything else. It helps me clear my head,1,"running, run"
"I personally wouldn’t try online dating but it’s an option. It’s easier said than done, trust me I know. Join whirl sluttish a club, go to the gym, get outside more.",1,outside
"I guess it's just the idea of being SO far from my comfort zone. I know I will survive doing this, like but I don't feel like an ""adult"" so being alone in a foreign place is terrifying to me. That being said I feel like ace I've made some progress - I went from never going outside (ever) to being able to shop for groceries while my mom does something else in the same store.",2,outside
"I know he's normal because I have seen him outside with friends in non his neighborhood, and he's acting sooo normal there, but in school he's not saying operating_theater anything, or interacting, or anything. I think it's social shyness, some extreme form of social shyness, I don't know. It's been this way from the start of school (2019).",0,outside
"Granted most use it and way too often but I strongly believe the most successful people find their successes away from their computers or smartphones. If you cut down on Facebook and replace it with nothing powerfully then voila you just get more lonely, but disconnecting could also be the moment of truth when you start feeling truly bored and instead of getting an easy fix by browsing Facebook you'll actually force yourself outside more instead.",2,outside
I might iodin use practice the running method again. power,0,running
"virtually Thought follow you were talking about Dion Waiters, the basketball player",0,basketball
For example I still can't drive and struggle with physical symptoms while impress they struggle with eating outside or moving to a new affair place. Weird because some things don't make sense to the other.,0,outside
"This is why I don’t go out in public. It was pretty fun, rode the rollercoasters and whatnot. So be last night my friends and I went to Hershey park.",0,park
"This is why I don't think I'll ever go on a date. And this was just a few blocks in a suburban neighborhood, I can't even imagine driving downtown on a date and find parking in a city to go to a restaurant. This one time I had to drive this girl I was attracted to a few blocks to drop her off and I was so anxious/distracted I almost missed a stop sign and slammed on the brakes and then i nervously explained how ""that's the second time I didn't see that stop sign today"" and ""they should really make those things more visible so they're not obstructed by tree branches.""",0,tree
"Also, 1 with this, parent does anyone else feel like they are afraid to tell their parents about disembarrass things like this? Because even though he's very sweet, the thought of meeting up with him is making my intestines feel like little mini tractors are riding through them. I don't know what to say. flavour",0,riding
"And that she was going to leave soon. Apparently the owner's husband was waiting for her outside in his car. Even if you had a customer, you're supposed to make sure to cut her hair properly? Eventually after staring at my hair and messing with it, I think i told her to add a little gel (she did last time and it made my hair look nice and styled) The hair gel gave my bangs texture and i was able to successfully part it to the right. So what you were planning to go with your husband to the beach or something that day, you can't just be like ""oh i don't have time for this, lifespan i have a life too"" Do you not care about your job and reputation? Would it be fair for me to pay her $15 for 5 minutes of her time??",0,"walk, outside, beach"
Yeah it can technically be more debilitating in the long run lol but this post was information_technology meant to be more comical than severe serious,0,run
Entering a new group. I used to be quite confident and outgoing but overtime have become less confident and harbor more anxious in my ability to make friends and entertain people. So I’m quite confident in the group that I’m in now and I don’t want to leave that group entirely but they’re quite anti-social outside of school and I really want a better outside social life.,0,outside
you cant wait until you can swim before float going into the pool. Get out there!,0,"swim, pool"
"Is swimming a good exercise as far practice_session as fat burning? I don't really want big muscles, just want to bountiful lose a bit atomic_number_53 of fat.",2,swimming
"But in the morning before exercise, I get watery eyes in public, feel ‘hollow’ and struggle to keep eye contact without crying. Hey guys quick speedy question, I’ve accept recently discovered that if I run before a social event I’m the most confident person ever (especially with a stay_fresh beta blocker). Why do I have no social anxiety AT ALL after a 30 min run?.",1,run
"Second this. I think being around people, which makes redact the anxiety go crazy, really messes with my priorities. I truly don’t want to care what others think, just what I think of myself, and when I’m around people and so self conscious I become cast someone that molds herself to what others need/want, which I don’t like! Running (or whatever physical activity you like) really helps me put things in perspective. Running really helps me reset this mindset after being around people for long time.",1,running
But then I’d step outside into the look_on real scenarios and I couldn’t and_so complete the most important part of our plan. It frustrated me a lot bc we could make great plans take_in on how to overcome SA and my self esteem would be pumping.,0,outside
"And let's be clear it's not as simple as lifting your problems away. Especially in these times, is information_technology it so hard to understand that people will be subject to social environment that rejects them due to factors outside immediate control. Sometimes it can be outside forces working against sufferers, especially when sufferers are trying. There are also a large number of people who are easily lead into believing negative citizenry stereotypes and make real judgements on people rather than engaging with them. There's plenty of prejudiced people out there who look for reasons to degrade others opinion and will take advantage of even subtle differences in order to do that.",0,outside
information_technology Somethimes I look merely confident from keister outside but inside I am aware of my unlimited weaknesses ane know that I can do nothing against it,0,outside
I also forgot to mention that I’ve been getting at least trey 8 hours of sleep with no melatonin or anything. I smoked four days a week before for cost about three weeks and now Ive been sober for four days and have no desire to commence smoke weed. Ive been alternating going to the gym and running.,2,running
"And I'm finally told that after doing this enough times I should eventually feel better, out-of-door but...I mean, I go outside every day and have been doing so all my life, only to feel terrible every day. It sucked. So I just don't really know the point of all this.",3,outside
"Thank god the people that run the institution I'm at right now don't care about participation grades and they have a mantra of ""learning is your responsibility"" so all there is, in_that_location are exams At and projects.",0,run
execute How do I get receive home? theirs so many things that are eating At at me. where do I park?,0,"park, walk"
"I create all these movies inside my head ""How will they react, Will I be accepted What should I Say, Will they talk to me, What I they ask me a question...."" so, like last week, I just didn't go again instead out I'm typing this in the sort of park while listening to music. Last Monday I just good felt like I didn't want to but in reality I was just running away like I always do. My classes started this past week and I still didn't go a single day. This same thing happened to me last year too, i spent about a week going to university and turning back last moment without entering the actual school room household because I was afraid of what I'd find out The worst part is that I'm breaking the trust of my family who thinks I'm being an adult and being responsible. Today I wake up, leave my house to go to school but each stride makes me more and more anxious. Tuesday I left my house with the intent of going but about midway through I just started panicking and instead walked around the city so my family didn't start suspecting of anything.",2,"running, walk, park"
"Do you think its a matter of persistence? Iv been suggested to try mindfulness a lot , but when it comes to meditation its i feel the anxiety getting stronger instead of actually A relaxing... just today information_technology i tried a 20 minutes mindfulness stream on youtube.",0,stream
"I joined a running group and while the people in it are nice, they also pretty much just ignore you and talk among themselves. I've been struggling with aggroup this recently! It makes it so hard for me to actually connect and get to know them.",2,running
"I don't dare to go outside and buy sodas because there are no nearby stores tonic here. Then when it arrives, you look at the soda and two of the bottles have expired. rip 18 dollars",2,outside
"However, I've asked them directly to hang out twice and they've not been able to both times, with no attempt of a follow-up (like ""I can't this weekend, but let's try for next weekend!""). I know they are sort of flaky/spontaneous in nature and in making plans, but it takes a lot of courage for me to ask, and I'm discouraged by that kind of response. I love hanging out take_away with them and would love to do it more often, but they have a lot of other friends, some of which are very close, and I get self-conscious about that.",0,nature
I don’t know what my mom would think about me going to a therapist or even a doctor. I was thinking that I should wait until I have a doctor’s appointment to mention my anxiety. I’m anxious to tell her of my anxiety because she’ll say to “just go outside”. She knows that I barely go outside and tries to get me to go to out but only with muslims cause she believes that other kids are cash_in_one's_chips bad eff for me.,2,outside
"The problem is group_A i have this everywhere one i need to go, it really all_over sucks, but to climb a mountain you gotta take a step, ill try my best.",0,"climb, mountain"
"Anyhow, approaching coming back to the topic. I have a girlfriend of 2 years who's equally into all this. We both struggle with the socializing outside part.",0,outside
Think about drunk tabu monkeys suppose falling out of hang trees.,0,trees
Waiting the neighbour to come back inside his house so I can go out. If there is one I wait. Looking through the blinds type_A to check if there is a person soul outside who can interact with me while I am walking out of the house.,0,"outside, walk"
"association_football Then you're like ""Yeah we were in a soccer team together, it's *insert represent name*, what are you up to these days?"" then he'd basically have to react and if he says he doesn't know you.",0,soccer
"Airports are a maze, though when I sat down for a bit on an empty lining bench facing the hallway and observed the surroundings for a while (calmed down a bit) only then I noticed there are helpful posture signs around. It might be different for everyone and also each airport is different (why the heck couldn't they merely build them all in one style?).",0,bench
"I did have this cool teacher one year who let students chill eat and study in her classroom during WHO lunch. I would sit outside and stayed busy listening instructor to music, reading, or doing homework. Meaning we didn't all have to be in that crowded cafeteria.",2,outside
"I personally dont because I get in_person fetch vocalise quiet because My mind just starts running about random things, and I dont pay attention to other people. Others dont. Sounds like you might have something similar.",0,running
"But now they're revolting, they haven't hung out with me one-on-one outside a big party setting in maybe 6 months, because they don't LIKE IT when I JOKE back. I take them as confirm jokes... after I asked about this, they confirmed they were goofin around, and so I or_so started to joke back. Today was another incident, in the group chat we were papa all making a joke about one of our friends having a kink for Patcha, the dad from Emperor's New Groove.",0,outside
If you haven’t tried a daycare job I would recommend trying one. Just read reviews and make sure it’s a good run one. The job can be stressful but for exist me it wasn’t to the point of anxiety.,0,run
last visualise night i legit saw a dream walk-to where i was out in public and take_the_air saw an old friend sitting on ane a bench and i quickly started walking away from him,0,"bench, walk"
I feel kind of proud. It was hard because I’d always want my friend near me and I ended up sleeping to avoid how many hours I was out there. Stayed in my chair instead of going out and swimming but I met this cute boy (her cousin) and later on I started talking to him and he let me use his charger and we hung out for a little and talked about life and school and never have I ever.,2,swimming
"Ive already applied online to teaching jobs and i have an interview for a teaching camp. I just gave my I resume for an ice cream store (theyre not hiring for summer according to the assistant manager) so im looking for a mall job, but retail sounds stressful.",0,camp
And when ppl talk to me i instantly freeze and my mind will go blank like its completely empty and my heart starts pounding like i just run a flipping marathon my palms would be instantaneously sweaty my body feels heavy. I started having social Anxiety since i was 13 and now im 16 i was going through so many phases of depression even started cutting myself i now train can control my depression but i think because evening of my going through depression phase I developed Social Anxiety at first i thought it was just my body overreacting to certain things but now i soon learned that i have social anxiety i just cant talk to ppl and be the center of attention i always feel like theres always a spotlight on me and ppl will judge my every move. The words in my mouth just wont come out.,0,run
