text,label,keyword
"I don’t think. I was wearing a grey Jordan’s hoodie and some sunglasses, im not overweight and im underweight, im just a normal-ass slender 5’10 guy so Thomas_More why has this made me want to never ever step foot outside again? It doesn’t feel good being laughed at like that. Just when I start thinking ‘wow I could really do this regularly’ these two girls walk past, spot me in the window and start laughing, then as they walk, keep looking back at me and keep laughing but a bit more this time. So I’m sat In greggs getting myself some lunch and decided id make a change and eat in. type_A TL;DR. thought I was doing good with my ‘anxiety’ Got laughed at by some girls when I was in greggs eating my lunch. Then 5 minutes later walk past the opposite way and do the same thing with increased laughter. Then realised I was doin actually doing poorly and now I wanna never set foot outside again, all over something so small.",2,"walk, outside"
I post this immense challenge and get 5. People post about how proud gallant they are about managing to make whirl a phone call or go outside and get HUNDREDS of upvotes. Wow.,0,outside
"But my stutter just makes me so damn quiet. My whole family but my mother is very falter social and outgoing, I am too but my stutter has made tinker's_damn me so quiet all my life. Still today with a severe social anxiety and depression I still want to be social, have fun outside and talk.",2,outside
"I'm near your age and have had two jobs thus far. My social anxiety is very crippling, but I realize I need money to make my life better in the long run (i.e college funds, rent, etc). So here are some personal tips: nn1. Volunteer. Local pet shelters are great for this as they accept everyone who is willing and not a crazy psycho trying to skin cats. This will introduce you to the antiophthalmic_factor social environment of work, and if you volunteer at a pet shelter you will have animals to calm you during the stressful moments. Plus you can literally decide to go whenever you want. For me I go once a week for an hour or two and I even lead shifts now. It helps.nn2. Apply for quiet places. Like a fabrics store or garden center. Something very mello will help your anxiety. My first job was at Walmart in the produce section. The worst you'll have to deal with is someone asking you where the oranges are while standing in front of them. You don't have to work at McDonald's boo, you can be a recluse and water plants for 6 hours a day.nn3. You have phone anxiety like me, so don't pick up! behave Let them leave a voicemail. I got so many calls when applying for my first jobs and never once answered the first time. They would leave a voicemail and I would promptly call back within 2 hours to a day and give some believable excuse as to why I couldn't answer such as I was in school, on the road, personal issue, bad cell service, etc. They'd always be happy to hear back and I would schedule interviews that way. Once you multitude have an interview, save their number and wait for a call back and pick up if you can that time.nn4. Practice practice practice! Write down possible questions and answers to them. Go over them outloud. Take phone calls in a quiet or calm place. Practice common interview questions and prepare to be nervous.nn5. Set your hours low at first and work later or in the mornings. Go for about 18 to 20 a week and work from there. Do NOT, I REPEAT, DON'T set hours you'll hate out of desperation that they will only want you if your availability is from 8am to 10pm Monday to Sunday. Also, pick late or early shifts. I.e pick shifts after people go to work for the day to before they get off (9am to 3pm) or after they are usually at home or asleep (9pm to early am for me personally). This is a great time to work at a store like Walmart, Target, etc. The most customers you'll face are nurses or old women who are looking for plants in the meat asile. Get to know your city's schedule and schedule yourself for times when the mass of people are typically busy or elsewhere. 24 hour stores are usually in need of people for these shifts.nn6. Finally, tell them you have anxiety. I have had two jobs, but have been offered over five and have applied to about 15 places. All of which, if I was interviewed, I explained my social anxiety. Employers nowadays are a bit more sensitive to this. You can say ""I have very bad social anxiety, and would prefer doing things mostly in the back or away from people until I am used to the work environment to prevent any problems from arising."" They'll usually say ""well we will train you to do x thing, but if it takes some time we'll work with you."" That's when you know they're interested. Don't hide your anxiety to someone who can affect your future employability. My current boss and assistant manager both know how bad I suffer and often coddle me when they see it affecting my work performance. My fellow employees, though I am not friends with them, also understand this and will help me. I work in a pizza place and I take orders on register, give out food, and answer phones. When I need to step away I ask someone to take over and they will. Getting overwhelmed isn't bad, just take a second to step back.nnSome other general tips to remember: Always apply for jobs you'll like FIRST, wait a few days, and then apply for jobs you can deal with theoretically. Try to really go for jobs that match your interests as it'll be easier to adjust to.nnIf you get denied, don't freak. I did this before and it does nothing but take away all your hard work. An interview will happen again.nnI hope I helped.",1,Garden
I know... You have all these desires and dreams you can't just be normal outside let alone when there are some place full of more_or_less people. wealthy_person The solution is so close on_that_point yet so far.,0,outside
I am afraid to even leave my bedroom in my own home that is shared by just me and my very supportive boyfriend. I am afraid to go outside or ane even apply for fifty-fifty jobs because I know I won't get through the interview and if I do even make it that far I leave the job or get fired because depart I just stop showing up. I'm at a complete loss.,3,outside
"For me, its for forcing laughter and positivity. Just like swimming against the current: your body tells you IT to cry, but instead you make it laugh. The apples of the cheeks really hurt afterwards as well.",0,swimming
"I just don't find many things that interesting. Maybe it's my one area, I know for certain 1 if I lived somewhere else I'd be outside all the time, even if I'm on my own.",2,outside
"Barely any people outside when its dark so its whatever awesome, and rain is the most soothing feel",1,outside
One thing that really helped me just get outside and around people was going on walks/running around a trail. It was terrifying the first few times but then I realized that no iodine one really some cared that I was matter there.,1,"outside, walk, running"
"However I am worried that this problem is going to follow me everywhere since I seem to perfectionistic about who I be friends with. World_Health_Organization I am thinking maybe a running some community. I'm constantly looking for communities I can join which I will feel comfortable with. If anyone else has dealt with this, it would be great to hear some advice. Like I already know I don't care about run give times and stuff so I may feel out of place being surrounded by people who do care. unity",2,"running, run"
"warlike community_of_interests Dance, martial arts, parkour, cooking, anything. Help the community out, volunteer. Take up residential_district classes.",2,parkour
"Happiness does not fix much tbh when you stop feeling it for a while then you finally realise all the things that are wrong with you.It did make me feel better at the time lol maybe it's not ""pointless"" even if I'm close not perfect from feeling it. I always ending ane up wishing I just force-said what hoi_polloi I wanted to because then I would be ""confident"" and then none of this shit would be happening. I have tried it outside before but being around other people basically just counteracts it because of anxiety to talk. I thought meditating in fucking college information_technology toilets and the local park back then with a laptop/phone and meditation music would help but it didn’t. It didn't mean I wasn't fucking anxious though, even though a couple of months ago when I was doing that, I thought it was ""normal"" to be anxious when it wasn't. It only really seems to help me temporarily and if I'm at home doing it for some reason.",2,"outside, park"
I waste all my time online. That's it. The only time I go fourth_dimension exclusively outside is when I'm going to work.,2,outside
"I decided to do another one. I went in and started talking to the girl that worked there single about mini golf, like asking questions and stuff. It went fine and I wasn’t too nervous at all. So I set_forth come_out was at the mall and saw single this mini golf place.",0,golf
"I a_great_deal astatine struggle a lot at work and no matter how much I try, I’ll never be comfortable. Running an online business 1 to avoid social anxiety.",0,running
"But earlier I just really wished there was a reset button in life. I know, I’m making mountains out of molehills!! I’m worried that they’ll think I’m weird and ungrateful and won’t bother to offer me rides home in the future.",0,mountains
"Could be a song you like, food, an activity, a person, an item of clothing you like to Be wear, a place you like to be, doing chores, cleaning, writing, drawing. It would be cool to hear what yours would be. tramp Mine would be swimming, the weightlessness ilk you feel, drifting about in the water and the splashing sounds around me.",1,swimming
Nowadays though I just don't have the time to let my anxiety consume me like I used to. When I atomic_number_53 left the store and got ace back outside I considered just getting in my car and leaving - 5 years ago I would've done exactly class that.,0,outside
"For me my smartphone helped a lot. I have A deoxyadenosine_monophosphate concluded for myself it is not something bad, just a lesser form of socializing, with oneself. I would just set it up, or hold it while walking outside and tell it about all the thoughts in my head.",2,"walk, outside"
"But astatine up on that ladder the view is much better than at the bottom. Maybe you'll be able to reach the branches of a fruit tree, see a yield path that leads to your destination or just enjoy the sunshine on your face (alright enough with the metaphors). Not hating yourself and having self-confidence also gives you the ability pass_on to reflect on other people's behavior towards you.",0,tree
"I always sit by myself at recess drawing birth and wishing I had friends ampere to play basketball with. I’m always lonely hoops and alone, I hate it: No one has ever had a crush on me.",0,basketball
"How can I change my life and get back to living? How do I get myself out there, ignore my away thoughts and feelings and deal with the burden nature set_about has inflicted upon me?",0,nature
"I've developed social anxiety since moving to a foreign country.. Back in my home country, I did not have this debilitating sense of dread whenever I needed to go outside. And I'm just there, probably they're oblivious to represent me even being there. Here's how my daily life feels like to me: I leave my apartment complex exist and walk to university. I have lived in Asia and went to an international school since the second grade. I refuse to acknowledge that I have a problem, and I keep looking for reasons as to why I might be the way I am now. I see people I've talked to before, but for some fucking reason I decide not to make eye contact and sit/lounge around alone. I take out cover my phone, hoping that nobody notices that I am a loner. I try not to make a fuss about it but I am actually panicking about where I would be able to sit down, without attracting attention to myself. I walk into the class, and am greeted by the sight and sound of hundreds of students in this massive lecture hall. I'm afraid of the eyes that aren't probably even looking in my direction, of the laughter I hear around me, thinking that it must be at my expense, while simultaneously knowing that it isn't. On my way, I feel that everybody is looking at me, judging me for being so awkward and lame. Once I get to the laugh lecture rooms, people are conversing outside, talking to each other while waiting for class to start. Once lecture finishes, and classes are done for the day, I immediately walk back to my room. The worst part of all this is that I can't figure out why I am the way I am now. This walk back is often filled with bitterness and intense feeling of loneliness, as I pass by other students walking with their friends. Why could I function normally, and live without fear back home but once here I'm afraid of the outside world.",3,"outside, walk"
Do you actually have a bladder problem or axerophthol do you just run to the bathroom to only escape? Might have to get that checked out make by a good doctor.,0,run
"Also to make it worse I run really fast which I feel draws a lot of attention to me. But now that school has started, not only can't I run there but theres like the fear of morning hustle and bustle of parents dropping off kids no matter where I run. I even walk way faster then normal. I so agree its such a feel good thing for me. I use to go running at this track in the field of a school early in the morning like 6:30. Running in the daytime is just the worst so many people. and directly this is weird but its almost hard for me to slow down, I feel like I'm galloping like a horse or something.",1,"running, run, horse, walk"
"Go out for a walk once a day additionally and slowly start increasing the time you spend outside. If you can, try to take your dog to a dog park or something like that. If you atomic_number_85 trust her, talk to your friend about your problems. Start doing sport, either outdoors or at a gym. Try firedog to go a different route everytime if it's not causing too much stress. Try to make smalltalk with the other dog get_going owners. You don't have to talk to people just drink one drink and then go home after half an hour.",1,"walk, outside, outdoors, park"
I wish I had stayed at iodine home from the start. It was freezing out and everyone spent rest_home the majority of the time outside,2,outside
"What do you think is the most effective way to stop comparing yourself to others?. Even if I may want to the processes in my mind continue comprise running and it ends up influencing my beliefs and my moment-to-moment behavior in a situation as well as leading to fluctuations AS in my mood. It's definitely not as easy as ""just stop take judgement comparing yourself"", which is basically asking yourself to just stop thoughts.",0,running
"Usually just gaming, drawing, reading stuff on the internet, taking the dog out for a walk, clobber amp and occasionally going for a jog!",2,"walk, jog"
"I just sometimes can't find what to talk about, especially with my girl friends and only saying hi to them only makes them think I'm boring and I am not still really worth to talk with. All of my classmates don't care young_lady even slightly about me and pretend as if I don't exist at all. I almost never atomic_number_85 got invited to hang around outside or to birthday parties in my life, all I do is sit at home infront of my computer all day.",2,outside
Yes I hate that I have to run away from i something glad simple like that. I detest hate that I'm happy to run home from living life.,0,run
"Try going places where you would meet people (since you're not angstrom get_going employed you can't see people via work) there's a big chance someone will approach you if your social anxiety wont let you approach them. Also when I have to go shopping, always late at night. I like biking so I've slowly but surely started to leave the house and see places/people whenever my anxiety lets me. I tend to go when there's as little people outside as possible.",2,"biking, outside"
"A lot of people on there are having the same problems you are. All these things can attribute to feeling extremely better and having more energy. Change your diet to a healthy diet(no sugars or wheat), stop masturbating along with watching porn, exercise daily(running or working out), take cold showers daily, meditate, and limit your amount of time watching tv or sum being on your phone/computer.",1,running
"* Crazy right? * I screwed my life pretty bad/acomplished nothing, so there's nothing about me to be proud of. And when I think about it, I look fine and everything but the moment I step outside all I can think of is *Why would anyone want to be nigh friends with me??",0,outside
All the while I am starting to delineate burn up inside and get that anxious sick feeling. Overall apart from my run of the mill questions I have added nothing to the dialogue of the group for the entire night. Someone talks draws attention to my silence by asking if there is something wrong with me as I haven't spoken.,0,run
"Thanks for answering, and I'll check out Aubrey Plaza's videos, I don't know her yet, but I was gonna watch Maine Parks and Recreation soon so it comes out perfectly to me Worst case scenario, I won't get any part and I'll get nervous, still I won't die, and I'll keep trying until I'm comfortable.",0,parks
"Yes, that what I usually do... but I wish I had not to do it. I wish I could go to the unity swiminig pool as anyone else, but everytime I do I have felt those looks of pity in the face of people and I really normally hate it. Thanks for answering!",3,"swim, pool"
"10 years of SA, it's been going information_technology up and down but when it comes to the social side on the Internet it's been a straight line down and from that my friend count just drops everywhere. I don't dare to start conversations, I don't dare to start online video games anymore even though I have no idea why I'm afraid while when it comes to outside stuff I went to a mall and bought stuff in three stores without panicking too hard yesterday. SA is telecasting weird.",0,outside
"I'm not sure why that is because I do enjoy going secret_plan out, maybe I've grown use to the habit of staying home? I've been wanting to go sure_enough to the gym, park but I cant pinpoint this feeling of being a little afraid to go. Something, that I'm guessing is anxiety, drives me to the point where I stay home and play video games everyday.",3,park
"I feel I always take the backseat all the time inch and just laugh off everything and is just nice to everyone for the sake of it. Like I feel like a npc from a forever video game - like if I slip up or get mad or do something out of character that everyone will start to judge me cause I’m the only black guy in a pool of white people. The thing is, all my friends are white and I just always feel like there’s something missing about me.",0,pool
KO'd Hiking? drop_dead Indiana Going KO'd out in the woods,2,hiking
"Someone you feel sympathetic for by just glancing at them. When I imagine myself as an older lady, I picture myself sitting in the middle of a park, smoking, alone. who is able to have fulfilling relationships with people!",0,park
"i always wear a mask in every occasion like for example Sweet 17 IN party, prom, social interaction and still many more but when i arrive at my home or in a empty place i feel relieve that i can remove my mask this because my sun fanny is Gemini which rule my physic but my moon is Libra which rule my emotion and thought so yeah basically i deoxyadenosine_monophosphate can mask my real emotion and feeling which is afraid to talk to other or meet many people me me i do LMAO.",0,sun
"If you happen to live in a big city, try dog walking. That's what I do and I love every second of it. You don't have to interact with too much angstrom_unit ppl besides the doormen and people who may want to pet the dog lol.",2,walk
"although it would be really helpful to have parents thrum who care and understand (more than helpful, rattling and it's really fucking sad that they don't ""believe"" in mental health disorders) it might be beating a dead horse if you talk to them and they still don't understand. i'm 21f, first of all i'm really sorry :( at least you're of legal age to get medical help on your own, so please don't worry about what your parents think because you don't legally need them for this. please know you're not alone at least, and your problems are very valid.",0,horse
"A friend. Ofcourse! Sometimes, late at night when I've played my 15th DotA game fume in a row, and smoked my last cigarette and I look English outside into the empty, desolate woodland I wonder what it would be like to have someone by my side to pass the time.",0,outside
"I can wash it like three times in a row because I three even dread touching the faucet. Plus I don't go outside either. Well now hebdomad I Hoosier_State do, since I take a language course three times a week (average of 10 students) but I'm always home with the same 3 people. ace",0,outside
"I am living in my small little apartment and haven't interacted with anyone for four months. Or when I was being put in a home for disfunctional children, but ran away again and again, hiding in a forest and shit. There have been worse moments in those six years, like waking up to police kicking down your door to bring you to a psych ward, my mum not flat letting me inside the house for 2 days to make me tough and my anxiety disappear, thanks for that.",2,forest
I don’t have insurance and I wouldn’t want to rely on medication that would bump disqualify me from joining the military. It’s just a awful cycle I unity created. I’m like 90% sure lack I have hypothyroidism but the doctor I went to check my blood said my levels were normal even though it runs in my family :/ so I NEED to get a job so I can find an endo and find out what’s wrong with me.,0,runs
Yeah that camp felt like being stuck with a group tear of annoying people in the middle of nowhere. But I think I inject might try giving therapy another shot with a good person one on one.,2,camp
"distinctive The rooms are pretty small themselves and bathrooms are shared either suite (two connected rooms with bathroom in between so 4+ people) or hall (a floor of people divvy_up sharing a bathroom at the end) style- at this particular camp they were suite-style Yeah we have to share rooms unfortunately- there are some colleges with singles but they aren't common, elbow_room double and triple rooms are the typical thing.",0,camp
"I have been invited to a BBQ and it is really giving me anxiety(is in 2 weeks). My feet are weird, I am too white, I have scholiosis... overly The main reason is that there are people I don´t know and that I am scared if they will try to go to the swiming pool, because I have big complexes.",3,"swim, pool"
"I could probably handle the meetup in a slightly better way, but I have trouble taking part in online discussions. single I'm on some sites where political issues are discussed, so there's LOTS of fighting, and strangely enough, I don't feel any anxiety there, even though someone on that site wished for me to get run over by a truck (because I'm not Islamophobic) and others threatened me with other kinds of violence, and someone generally disagrees with my posts all the time. Maybe that's because I don't give anxiousness a damn about opinions of hardcore right wingers, even when it's an opinion about me.",0,run
"I myself want to run away from the enviroment of my country because of bullying that happend 10 years ago, I am class 24 fly_the_coop now last year in University. I think where ever you go you are still you. We must change the perception of the Hoosier_State outside world and safe surround ourselves with good people.",0,"outside, run"
"After any_longer that I decided that I wouldn't take anymore of these various prescribed pills, also none ever did anything in various doses for about 2 years. I almost missed a amazing trip neglect to the mountains because I was throwing up. atomic_number_49 I stopped taking mine after a while I would have annoying side effects that had to do with eating... always",2,mountains
"Her office was just a 5 minute walk from my house and, as I also have driving anxiety, it type_A was perfect. I called her, told her I preferred using email and we practice arranged the first appointment that way. I ended up spending start a couple months looking up a bunch of counselors online and found a lady that looked really nice.",0,walk
"Ever since college I've more or less lived my life online. I left the meeting and didn't come back (ended up pacing outside for two hours before I calmed down enough to go inside). I never had many friends at school and even though I played sports for ten years (baseball) I never really got a 'social network' going. I've struggled with social anxiety as long as I can remember. IRL I'm too nervous to be who I am -- a fun loving extrovert -- because of my anxiety. Over the years I've managed quite the collection of bad memories at dozens of social events where I have hid, snapped, or run away. The internet is the only outlet I have to really express myself because most of the social pressures in day to day interaction don't exist. The most recent example was a all staff meeting at work where I first went to the bathroom to avoid introducing myself to my coworkers and a half hour later had a row with one of them because of a misunderstanding.",2,"baseball, run, outside"
