text,label,keyword
"Yes i but without drugs, dont think is safe or helpful on long run all (sleeping I mean completely ignore you feeling, of thinking and observing what you are feeling, does that make any sense?",0,run
would’ve made an excuse to run Man U gotta go. That Shit is rough.,0,run
"I am genuinely interested in who she is, what her name is and so on ( although i do want bang her hard).but the moment my go to is the same as it always been- keep your head down end the interaction as soon as possible. i could tell she wanted me to talk to her , but i just couldn't work the do i started kind of her, when i wasn't at the would run through scenarios in my head- like play out what would happen when i went to her so on ( basically to my self, and play out fantasys in my head). i think this took something was to be really simple go to a chick whose checking you out and say hello, introduce yourself) and made it harder it to be, i created this pressure on myself. i to get to know who she is. im not in the im and running from it.",0,"run, walk, running"
"18 and some friends here, but I don’t think they care. I think I might just run too cuz definitely won’t confront my parents.",0,run
"I'm attention just tired of feeling alone. I honestly wouldn't even care. Social media and are literally gateways the outside world, at point.",0,outside
I like you're older couple who say hi to me my bike ride work in the morning. They are nice. They don't say hi and know they might be just like you and you accept that.,2,bike
I feel like I'm going die each time I run scenario my I still so much to after that. bus ride there is to be hell and the rest isn't going to much better.,0,"walk, run"
I I'll it tomorrow morning. I'm like 5-6am. Idk what time the opens though.,2,park
"Even five years later, my was to walk away the moment I thought I heard someone and put on my practiced expression if someone were watching me. though I graduated five years ago, I still felt nervous. Even though school is on winter break and campus was empty, I found myself hesitant to where there were people. school was about I didn't have a single friend in high spite of my initial efforts to reach I joined soccer team; I quit because the name-calling. I lessons; I because the name-calling. I my high school on the pretext of seeing the new renovations, but I actually just wanted to like could everywhere without fear. was still scared to walk around campus, but I made do it (albeit there was no there), telling myself that this is my campus too, that I didn't have to run away and I have a right to be there. I'm to work through some stuff my own head, so no one needs to read or reply to this.",3,"walk, run, soccer"
Face the Stay outside college for 10 instead of running. Talk 1 min longer.,0,"outside, running"
Bro 6'0 and I 270 pounds (obese) around now but still and still obese. In room my puffy nipples poke through my shirt (still does). Still to reach my goals I do bike machine and my man would jiggle around and people would,0,bike
I being an and only actually running a research paper through an online plagiarism checker AFTER turned it in. Luckily my saw there was no but I was freaking out for a weak waiting for her to confront,0,running
"how I ended up with this. Very depressing looking at kids now a blast outside wandering yelling, just fun while my childhood summers were spent at home isolated, of others.",0,outside
"It just happenes, the interviewer smiles, you respond with a smile, can only happen if you are not anxious or any negative thoughts",0,running
"You could, but it can mean anything from physical sickness to feeling really that This a short term solution though, because it's hard to run own family all the time.",0,run
"riding I rarely use it usually if going friends at least one of us drinking anyways. But it also really constantly having to keep car clean and also the anxiety of making a wrong turn and messing my will hear left from a GPS even when it said turn right). If I need to use it alone, which is only 2-3 times year, I’ll usually sit unless offers seat.",0,riding
"Dont really have friend group in NYC and it sucks, anyone hangout thats around my age I like games, hiking, kayaking, woodworking, starting to learn After effects for work, movies etc. being so alone all time.",1,"hiking, kayak"
"I know it wouldn't be easy or desireable I think if I were in your position I look for some of alternative to a when it seems that bad, perhaps confront my about it some and ask if he really hates me or what problem is. I'm shy and really passive, but if someone is really me I draw a clear-cut line telling this is as as going to push me and more",0,riding
"Honestly the best way to is to get out and do things. Now saying to go to a party on the spot, just go take a in the park, that thing. way I myself to socialize was going out and",1,"walk, park"
"I just want to pack up and camping for a week but I know I back it will be exactly like I was never and have problems. Sorry for the little I'm having a shitty day. doing great, will fall be yes man and agree to do anything that comes your way",1,camping
Everyday just try do something improve life. Read a book. Take a,1,walk
"I convince myself that they will forget it by next session, even though know most people don’t care remember that of I’m the newest player in this so I’m self-conscious about the fact that they have to help me more often anyone else in group. I’ve run through my to talk myself out of the anxiety, but it’s not working.",0,run
"I couldn't figure it out and people to think me annoying for led to internal bullying. I've been a victim of the inside-bullying too. If I something I thought funny then people would default to arrogance and assume what was about to say would stupid and then look at laughing at what said as if were embarrassed I was trying to eye contact with them because I wasn't worth talking If I started people point and because ""you're a nerd and you can't be It's testament to how bad my social how asocial i was outside of classes what Nobody respected me and they obviously talked behind my back they I was annoying or weird or unlikeable and like you've experienced, they made these strange proclamations of my in class too and I the straw that broke back was when I started to realize that when we had to do the ""find to group with"" stuff people walk away as walked over to them if had occasionally before. People would put me down for whatever I did that wasn't academically succesful which was at least nice had something I was okay at",2,"walk, outside, running"
Didn't get courage to ask for for it so just held my biking but still a win! found the thing I needed and paid for it.,2,biking
"Haha I remember making a when I was 12 owned a caravan in a caravan park, her family used to go on there quite lot and she called me and invited me to come along, really really didn’t to, it’s not that I like her, just didn’t to be away home and her family was a little bit .. weird, I told her I’d ask my mum was allowed, i went to my my asked to go stay the for knows me and she said well do you to go, I my head and she said ‘well, no I can’t allow you to you’ll have tell her that I said no’ I was thankful lol especially as of felt guilty if I had just lied and said I couldnt go",0,park
"I can't get myself to leave the house unless I have to, I want to outside and might the summer since to get bmx as a little hobby. Also want to go music festivals but I've got nobody to with me.",1,outside
"Afterwards over-analyze everything that happened, even for days or weeks. I was terrified I went outside to get that a neighbor see me judge me. I wouldn’t go anywhere for weeks for of people seeing me. I’d only go grocery shopping at bizarre hours and only use the check out because of fear of what the cashier would think of me and my purchases. So how did I climb out…? Very slowly.",2,"outside, climb"
I'm going through some of posts you made but have to those photographs absolutely stunning. Where did you shoot them?,0,beach
Awkward... One word it.... That's just who am.... I'm and don't even act like a 15 year old. basically was meeting up a friend and bf at a then we were out park... My friend (wingman) go so it was just the two of alone and I was being...,2,park
"As we heading back confidence is already I'm everything in power not to bawl, I park and all he says to me is go through the exit meet him couldn't bring myself to go inside was so I had completely it began to a panic I also began to panic because I was waiting for me inside. I got and immediately started bawling again I was shook up about my mom I'm just shy) like why are you crying you passed! I pulled myself together just to go back he my total and to sign still a so I totally didn't process I passed honestly was waiting for the words ""you passed"") and then left. nearly out because I was with this off road kind of area back on to the main road. I was sobbing and wanted go home because I was still anxious about how awful test was. I'm to walk the building myself, the second out of the car I bawling and shaking.",0,"park, walk, outside"
As long as you're trying most people don't you're in football team then you'll probably be with the you're not yet just get put on the bench but will still be able to keep getting whenever attending training and once the people taking the team think you're you can get Things you can your own if got a back yard can help are - Do to one side to Practice dribbling Practice shots - a ball off a back and continue to do this,0,bench
"I had teenager years having fun with friends, I did not finish school and I’ve had a job yet. isolated having big problems even taking a short walk in my neighborhood.",2,walk
and look,0,run
"so fucking depressed. At school is most of my anxiety from, outside work some of co-workers (friends) think I’m one of the talkative, funniest, extroverted person they know. have zero friends at school, all I do is just my desk till my class is over and just my next class afterwards in a cycle. It makes me wonder what I achieve and I’ve missed out on the last couple Surely, and there I’ll have where talk to people but of the time I’m just quiet.",0,"walk, outside"
And I met way too many most days do nothing but today I errands to run and feeling positive at the beginning I've managed to embarrass myself different to every single person met,0,run
I was just at secondary school (year 9). a few years I went to (in the UK college is an extension of secondary which where I did my apprenticeship. My apprenticeship was working at a dog grooming place since I wanted to do with animals. I mostly and The woman just thought I was lacking communication in and found it weird that I didn’t when I there since don’t like eating around people. I was thinking about volunteering for dog walking at my shelter. I rang them a few weeks ago and they said to pop whenever I want. I just haven’t the courage to do so.,0,walk
"All throughout was severely bullied by few so called toxic friends, to point where to leave a few months before my study I plan temp at some service jobs before thinking about back into IT. My worry now that my town so believe I am going run in to bullies at my the bullying continue, which be because I'd probably end up quitting that as well.",0,run
"this point I was still functional enough to and go to basic places like doctors, dentists, grocery stores, etc. I'll attempt provide at least decent example. Then I lost all contact with supposed friends. Then the outside world completely. Those eventually stopped and I isolated myself, pretty professionally I say myself. Version #1, I feel like I have a 2 foot dick just blowing in the wind as sit comfortably my high horse look down on all the peasants. Version #2, I like I a 2 inch soggy day old breadstick from Caesar's say between my and I'm nothing more than the scum of the",2,"outside, lawn, horse"
of above. I love a walk around my is for There's always the off chance man will try to approach ask for money or something even I don't have any.,3,"outside, walk"
I also often take walk to a less shopping centre and eat the court there before going around the shops browse. I usually pick the isolated seats in the lecture room quietly and take notes while everyone is focused on the Other days I with my acquaintances in the student rooms.,0,walk
"I don't why happens but I'm guessing it's because used to be specifically remember once in gym I didn't want play soccer and a screamed ""FAGGOT!"" at me, and some others laughed.",0,soccer
"I’m interested in other people who have social anxiety since we understand each other the would be much less pronounced a situation like that. I’m open to doing many things like museums, hikes, watching movies, etc. Send me message if you’re interested.",2,hikes
"A lot of people my age find minuscule since they have explored the world... thing I notice is that most people my age are still living home, from current students who out into dorms or for university. Yesterday, I explored a new business park that only about minutes from house and I how I new.",0,park
"Does anybody go through bouts jealousy too?. Everywhere I like somebody me has done more, all because have kind of ability or be around other of I'm 24yo and I just think I'm running out of time to accomplish something the days I waste suffering from anxiety and just like time is running faster ever.",0,running
"All too often, say no. urban areas. I almost hate everyone at school. I cannot eye contact going outside. I cannot stand densely area. dislike most people at my school I sit at my computer neigh on doing I shouldn't be doing I speak in front of people I do not This one I HATE. break down my diagnosis into bullet points for the most relevant It's not because I'm lazy; rather fearful who's outside and might see me. My often ask me if I want to go on with and dog. Robot if anyone what is.",3,"outside, walk"
"I her I’ve been really into gardening lately and how I love helping animals so I thinking of it this: “I’ve always wanted to help my whole so I guess that taking care of the counts towards lol. I’ve talking to someone awhile and I’ve asked about their interests and what things are but haven’t asked her what she’s passionate about (like things that really care about a lot). The one a picture earlier is actually an endangered species so it’s really cool to have those in my yard” And then there ask: “So what would you say is something really passionate about?” We’ve kinda been joking around lot lately too so maybe after that I’ll say: “Forgive me if that sounded weird lol, I wasn’t sure how to word Do you guys think that sounds okay?",0,gardening
like extremely highly the situation unless you're leaving out extra details. Are these girls you've had past interactions with? said went the park late so that I bump into,0,park
My out early and I’m siting in my ride.been out here sub freezing for 20 and I’ve got another 25-30 go. Sitting outside in the cold cuz I can’t bring myself to go back inside.,0,outside
"That’s exactly what we’re doing, some taking walk. And thanks for the great advice, i should maybe also just take this as sort of a learning experience instead of having all kinds of expectations.",2,walk
And the more I do this the more socially I get. I a beer in but instead I’m in my room I avoid so many because I don’t want to a situation I’m really there because my social awkwardness. I hate this constant,2,"walk, sun"
"As awesome as it was it was a bit upsetting because this is the end of the and I wasn't gonna have much of a chance to her over the summer, added her on Facebook and thought that maybe I'd try a run her. I was comfortable. Then I saw had a boyfriend.",0,run
"Instead, how about be thankful we still have the rest of our lives to try and turn this Right? The time to plant tree was 20 years ago, the best time is now.",0,tree
"Do you any hobbies enjoy? been bit of a crappy week, just feeling tired and fed up, so yesterday when for longish bike ride. It felt good (not like my but good).",1,bike
"Anyway, I know this well. Confused, I over to only ones in sight and they ""Oh, don't have anyone to hang with? We had a school-trip to (I'm dane) in 2013 and I was just this state where was either very depressed or too passive and I knew it, everyone was a group and had run off when and had 2 hours do whatever before meeting in the",0,run
"I always just default to saying ""good how are you"", and she ended ""i'm doing really good"" and just seemed super excited but the conversation kind just ended since I didn't know what else to she was like awkwardly backwards her desk while and regaining balance on her lol. I feel like might really appear uninterested to her when we talk since I say much, and she doesn't to me that much anymore I may boring or too quiet I'm also literally just trying to time my post-lunch right she finishes lunch so it's hey you're going for now We went on an together and we had a really fun chat (we both just happened to go out walking at the same andnbsp; see her when we by like going to the cafeteria, I just awkwardly hi and that's it. good"", and overthinking the shit of the conversations and always end not happening. me no way!!""",2,walk
i've had literally the other way,0,run
"I up a pub in England a place. could its because i was a kid i felt like that until i but suddenly at 17 im to go to the store so confused? i apart soccer teams, i would go outside and wouldn't care.",2,"soccer, outside"
Also I am meditate again. I run regularly for years. nice feeling when you remove something from to do. Running I dont perceive,1,"running, run"
seem to be afraid of me.. I know it's about me because it every time and it really makes no because I've never anything to these what's funny is I've had people insult to my face so clearly not as scared as they like to act.And I it's because I don't talk to anybody think freak but shouldn't jump to the worst conclusion.I anyone of you can relate so maybe else me they don't Whenever my neighbors see me come of my house they literally run in the house and there's kid's out they'll yell at to go inside.Where I live now two of my neighbors this and I've had neighbors in last place I lived do same.,0,run
I would love to be a ranger but I also want to make a decent I’m planning on going into biology in the of doing research somewhere (hopefully alone) I have to get through college first I’m planning on it.,0,park
"in college here. nFirst advice don't the barber make it look good. knowing what type of cut you want or even them a picture of something you would like that way know for sure how you want it. Trust me not weird.nnI'm stressing over school and work is stressful I'm a my is falling because it I'm getting better because I'm to take breaks.nnI suggest same for you maybe some breaks if you have any hobbies focus more time on those, go walk workout(helps my mind and refresh me motivated).nnI that your hair matter as much as your personality can make people judge you so if getting a perfect haircut you that confidence I said earlier pictures off google of reasonable haircuts that you have and show it your don't think it at all.nnI two years in my college and have to make friends so you are doing just sounds like you need to get out more besides concerts maybe other stuff idk.n",1,Go for a walk
"my way to an amusement park. Any tips ? I have and sun glasses , I took some cbd I feel a panic attack on. can’t I just be a normal dude .",0,"park, sun"
"I don't know. Like a story for example. There are a lot of social expectations which most people tend to follow because they care, but because makes not rock the boat.",0,boat
"would get and run straight for the toilet after like hours holding it during class. I would piss just before I left for school, then didn't drink anything the entire Not worth it, lol.",0,run
"I many opportunities at public speaking growing up, I STILL get nervous and lose my train of thought. Growing up, I did countless presentations at school, youth groups, summer camps, and I've taken public speaking and college. I'm still always nervous",0,camps
"My glasses turn darker when light/sunny outside ( even winter) sometimes don't even realise it turned but when I do realise I I'm standing out because I'm wearing ""sunglasses"" :cowboy_hat_face:",0,outside
started being after finding a hobby. the I run and in the winter I cross country ski. Makes me happier even though I no to do it with.,1,run
"He looking at me, so decided to wave. I bad now.. out to take out the trash my neighbor was outside across the street from me.",2,outside
"looking the person, in case our conversation runs dry, look at other outside factors. All depends on how conversation is going. At I would focus on the other person. But me in a group of sorts school, a group, a meetup.com group), and I'll able to talk and quite a bit. Don't look at any ""inside"" factors, such as: How how I got from empty, blank mind to occasionally have some things about"": I used to the idea being mind in a conversation, it didn't much thinking. Sportsfans, Jokesters, engaged.. Over time will to recognize these basic aspects a person will know what likely enjoy talking about. The thing is to try and force yourself to focus the OUTSIDE are we?",0,"outside, runs"
He away too. I didn’t the door because didn’t think it was since only the four of us in the small apartment. My stepdad thought that mom left the water running and he accidentally the curtain and saw everything.,0,"walk, running"
Brainstorming myself too haha Like let's smoke pot or let's go play basketball or Maybe ask people to do some stuff more specifically not just let's hang so they would more likely to would fun and say yes?,0,basketball
I decided to dogs and Instagram account teach myself the side of Facebook and set myself apart from other candidates). I got the job I and I also really enjoy running page. They off and I've gone corgi meetups and have been involved things I wouldn't have.,0,running
Any tips? if can me a run of what happen on side that would be great. Idk if I should say airport.,0,run
"I don't really give shit if someone thinks i'm gay, and they read our language at all it'd be easy to tell not a romantic item. I guy friends out the time and aren't afraid of the whole ""I love you man"" thing. If you're truly worried about go to a pool or something that.",0,pool
"There are plenty of options but none fit me. “Alright” “Hi”, “Hiya” and “Hey” too camp.",0,"camp, walk"
"I want go swimming, anxiety low self make it really hard.. Anxiety not even the biggest problem. Any tips I leave my house and go a swim and stop thinking how other people think about me? new swim shorts today and even think that it looks really good me. I even feel bad when I'm wearing a T-shirt because I feel like I'm really skinny. keep saying to myself that I'm too skinny and to pale. I'm least planning go for swim at a nearby lake but problem I have: I'm not really confident with my body. I'm here all summer, doing nothing and I want that. Maybe I'm just an idiot. for my English, I'm German. weirdest thing is that, when I look at myself in the mirror, think I look that bad.",3,"swimming, swim, lake"
"He said ""why are you still hanging high man?"" was stressed out about him not approving of a friend of mine, at this point I felt like he was attacking me. So i came outside to the car with him to goodbye in private, and I him if everything was okay.",2,outside
"I always think - how I'll go and try to get into some but then once I'm near my mind goes no"" and I the direction. I don't do drugs, don't drink alcohol, I don't any games, I don't any sport, I have social-media and it's really hard for me some people. So unless person would approach or get a support by person, which would be the best, I'm not capable of doing of",0,outside
Anyway we eat and then we went on a park to play some funny games. I think that him we would have been more shy! like 7 hours together.,2,park
"Good luck! Just try to as best as you can, and remember that something not so happens, the sun will rise and will try again |-/",0,sun
? Most of my will there from 7pm and I'm one of the 3 that has to until 9pm means that by the time get there most of will drunk. My anxiety running through the roof rn How do I navigate this night??,0,running
"Anyways, being nervous isnt of deal, everyone certain take deep breathes before, I dont recommend drinking, if you have a on you one? Dont listen to your mind, youre going to as fuck and its okay be do not resist it or that you are or youll just make things worse. I out girl today and I was nervous after about 20 of talking it went away and felt really comfortable with I started dancing not very srsly but still haha (we're outside and I mentioned I want get at dancing and she said show me I danced like a moron and started saying everything that came to granted out with her once in the but still a really attractive girl that me a bit nervous.",2,outside
"Be exciting. media, bars and clubs especially holidays, at football games, the (dog) park, grocery store, beach especially on memorial day. Stay in touch your city.. People follow each other man as get out join in...",2,"park, beach"
"It's like being mad at because it's too hot. Sun hot, are mostly stupid. They are not yet thinking, they the need for attention - so they snapchat, they feel sad and straight to zone they'll get of likes. Those eternal rules, instead of mad at someone living his hormonal-controlled period of life, work your if you real anxiety read on methods that reduce it (CBT therapy books).",0,sun
