text,label,keyword
Thanks for reassurance - probably I'm probably just overthinking actually been running a low grade fever for a couple hours now I may not have freaked over nothing after all.,0,running
I hadn’t even realized Id been looking down the entire time even i was trying to make eye contact. I mean i know don’t know what’s going inside them but i just can’t see how. I was basically stunned whole time. Like where? My anxiety even close to crippling (like to point where I can’t outside) so I don’t understand how who used to having normal and conversations and have confidence and stuff that experience anxiety. Yesterday I was taking a walk and my age approached me tried to introduce himself I guess by asking me questions about myself name and shit and this whole interaction was so alien and nerve to I didn’t even understand that I was supposed to ask back like 10 minutes later.,2,"walk, outside"
want to new people hang with but the thought of talking to a summer and I want hang outside instead of being home the whole summer.,2,outside
"Honestly my idea of a perfect date is Netflix home or going for a walk, or even going an arcade. I feel embarrassed when I I don’t drink. Thing is no my age wants do that stuff and feel embarrassed to say I don’t like it.",2,walk
"I One I'm always of when going outside is to meet people know, especially of my age.",3,outside
A week? haven't been outside months.,2,outside
It only allows one hour. Luckily someone on another subreddit helped me find a place not too far away where I can legally park the street. Thank you!,0,park
I need to love myself. I usually just run to the first guy that pays attention to me at all. We don't even have to other just lay with in silence.,0,run
Going out to a bar to play pool. Second time at bar. me,0,pool
"And why not Here's the part where I mention the could be doing to ease your mind: read, go outside, and we've all this spiel and know great they all are...but they are great, in fact probably the greatest things can do during these two weeks. It's quite a challenge but the reward of being being totally cool and calm you're there outweighs the effort of the next few weeks. Reading occupy your while you focused even entertained, going for a ride on a nice feels good in the sun. Trust man, change your life a bit, see what like to be you to be.",1,"outside, bike, sun"
Lol. Maybe that’s why constantly feel down,0,run
"I like next best thing, gimme pieces that"". She we have tasty forest So a quick glance over their selection of cakes and I on to ask about whether they had any with",2,"forest, walk"
"Anyways some of might remember my post from last about how I've been able to look the eye and recently, rather than shame. Going through the that I had been feeling pretty confident for I have been having a great day, actually had an errand to run and while was out I smiled at this lady and she smiled back and we bantered a little bit.",0,run
"hated it. Like singing else in public situations. When I tried once, head to swim, my body became numb, and I felt like I was going to fall over...",0,swim
Same here. I feel really awkward eating around people at my I always go to a that's not close.,1,park
"He got annoyed when I went with him said when can’t I just talk to parents. It me feel awkward, like I never want to go to a again. knowing anyone except for him I was a nervous but expected to with him most of the time. On back from smoking he’d start chatting to an older family member (uncle or for a significant while, leaving to just sit on my own or with his When I him if I could him on next smoke he but said I holding back talking While we were there he kept leaving me alone with his parents so he could smoke",0,outside
Did you like games solo puzzle Did like like that.,2,outdoors
"I found listening rain or the sounds of the while at school helps me calm down lot. I have a case of tinnitus, total silence me insane. I from being totally distracted to completely focused.",0,beach
"Kidding aside the debate about much can disease is very heated and people are opinionated, that's probably why they banned you. gotta keep in mind different subs are run different, very fallible people",0,run
I didn't people to see my skinny I stopped hide insecurities but way back I was school I used to wear a hoodie in any weather. It could be 100 degrees outside to take hoodie off.,2,outside
"I'm here as my sister's little and we're all adults, so feel like I've been the ultimate portrayal self-defeatedness. I've not with one tomorrow going back to my city study my and go down of loneliness because time I go outside I'm met with people I just can't relate to. It felt a walk shame. Music loud there and the 20 people",0,"walk, outside"
"I think that weed is a main thing that worsens anxiety in the run or keeps you from getting better. If you're about then I'd recommend making a post there about your and want quit, the people there are really quite supportive. Obviously I smoke myself, still true imo.",0,run
"I’ve been to one. It just run as a support group where there has SA. all mental illness groups it needs to be run by a therapist who conversation and people to talk. can’t expect you will go there and not talk, you have to be willing to be out of your comfort",0,run
"I guess see, the degree is still at away and I don't have motivation to stay at school, I always get anxiety attacks when I a full classroom:( edit: Also, I can fully understand why get yourself to attend can get really bad:/ I about dropping out and working a (they don't that bad wage here) and try to into something with my savings. I'm studying abroad where is not the local language so I really get a normal job, and such...and don't want to go home.",0,bike
"20 or around A year ago cousin's birthday party was in my with around 80 people in a small space, found compartment in a storage area, didnt get outside and didnt light It was heaven, was hot 45°C and that compartment it was.",0,outside
Being fun of for “too skinny” or “too quiet” or rude” is I didn’t people to watch the yard anyone by could and I didnt want to mess up it poorly. I if you know what this social feels like? I walk in every morning with headphones in make a beeline for the classroom and I would leave same way. It’s such an obvious and easy else but for me the hardest in the It’s the same reason I wouldn’t cut grass when I was younger. That may seem an over statement to you it’s not for me. down the long ways at work hoping no ones walking the What do I do when I cross path?,3,"walk, grass"
"Even at work I analyze everything I after I say it obsess over whether it made me look stupid. I had a weird fuckin day yesterday was super up and happy and energetic, like was completely unlike and I was telling my coworker next time they out to me know well boom apparently tonight manager is throwing party and I'm going was yesterday, but now it's currently 5:26am, the party is at I have adrenaline running through veins thinking all possible I could humiliate myself and make myself look stupid. I've worked at this particular location for almost now as of next month I've always held out or going to work parties everyone, partly cause I don't so bars aren't thing, because the anxiety is too much.",0,running
"But the I'll always message 7 times out of 10 I will get no reply, mostly if I do stop in like 5 or 10 messages, I've only 3 connections that I going somewhere but 3 got to point of them on a date and then going through they weren't ready even I'd only suggest going for a walk in town or a cup of coffee and a chat. don't what I'm there. PoF and okcupid more of the right types people on there.",2,walk
This. My freshman year I the team the first day while we were waiting for our coach to arrive I was because everybody else seemed to each There was this other freshman however I recognized I had him before in a tournament.,2,tennis
getting haircut causes a anxiety for me i keep delaying it for months i avoid it but my fear isnt into running (almost no one knows me anyway) but that the hairdresser outgoing and talkative. always causes so much awkwardness discomfort since simply cant communicate with people properly... so just hope that i get who isnt that,0,running
"Even if I have to go will people and if I have conversation, it is over until I get or even next will think what I said and what they might have thought about what I said or I think about what they said to me don’t phone calls if I don’t the number or I know the number but it is I feel may judge me I have a hard time making eye with people are judging me I don’t initiate or contribute to conversations with I don’t know or who I’m not with think that most people don’t like me run situations head before they happen to try to mentally prepare myself practice because I know when I’m the situation I will freeze I’m and tolerate me don’t want to spend time like a burden others I really left my since April and I left my 1 day to go to school for a class I needed get my Should I tell mom? Physical: I a time falling and staying asleep like I need a or music playing to fall asleep it distracts my thoughts and without a or music I would be left with my thoughts and have an even harder time falling asleep) I either wake up too late too early I feel tired and unmotivated most days I have trouble focusing/ concentrating Symptoms I get when I feel anxious certain social situations: blushing fast trouble catching breath mind going blank words won’t come out of my stiffness/muscle tension shaking feeling of control body feels to touch but I feel cold crying Emotional/Behavioural: I avoid with family and friends, school, work parties or dinners in of being judged or made fun of. how?",0,run
"and techniques work for some. Doing activity that you enjoy sometimes take your mind your worries, but I personally that thoughts can get overwhelming no matter what you're doing. prefer listening music, taking a or bath, etc.",1,walk
"then i would have to always social (just like now, but now it wouldnt choice) What do you guys think and anxiety? I am currently without job or education living at my dads place, but most likely start new education in february 2017 and move want a dog so running in the woods with it, and feeling less lonely.",0,running
"Here’s social anxieties silver lining, you use time wisely find outlet involves minimal social you’d be at the could have relation to your peers who to have it “better” than It place however I constantly have to interact with new people and and newer on a regular basis. Today, in my 20’s, I run a business out of bedroom where mix master rap music for a",0,run
"had no friends in middle school and barely any in high and it just made the experience miserable and I regret so things that I couldn't because of my social anxiety. I have anxiety for most of my life, has had a profound impact on me. My doctor my high blood pressure (even though i am skinny, and walk a lot) and my loss already underweight and first year of hs alone i 15+ lbs) and loss of appetite (some days I have so much anxiety I can't all day else get sick, and I went weeks barely eating anything before because",0,"walk, run"
"But since I have social I cant do it, I feel im social butterfly who is stuck a persons body. when we did, I couldnt meet her irl or her, just texting, so I pushed her away I didnt want to hurt her and I wasnt capable keeping since then we have had this strange relationship where we text once every few weeks it usually ends with a conflict. people think that I have a good style and im good looking and overall a person of all groups have said to me). somewhat believe it, but I have confidence to do things outside my or comfort zone, had a girlfriend(I who was close to away, she pretty and smart and cool I handle the pressure so when we close just handle it. would love to take on new hobbies and where other people who my age participate (like or just hanging out other teens). were childhood friends before and I didnt have any problem meeting her irl before we close.",3,"outside, skating"
"Definitely with the sports team you be there, and know if you show you'll letting them down/someone could have taken your place way think it means accepting that there's a decent chance it might suck and totally but it also might and either way it's better to have gone that not to gone. me, pressure is a lot effective than internal pressure.",0,outside
"Boy, I haven’t even scratched the surface being driver. I practiced my reversing before I went I one run of on a busy road the morning rush. Today, I to drive on a road during the day.",3,"walk, run"
"And get nervous as each group goes up feel could explode from the stress. I met others that I with through apps/online. not pretending I ever will (or want to) be a public speaker. Other times a really controlling loud mouth girl would all the (you know who are). without anxiety (professors) don't understand how scary these things are for us. Seriously, it's as if you're a and mind is screaming your body to The news those not in unique situation, is I have since made friends outside of the group. The most significant of the comes from the anticipation and of the presentation itself. This is not the this is your mind detecting a false threat and activating hormones forcing you into panicked of survival. Today, we are all still friends and are going through all the adult pains of moving no ect.. Ultimately, few meetings with kids outside of class, most of the time it smoothly because your all the same boat just trying to get grade and get out. Your shaking, sweating, using ounce of energy to not or run right out of there.",0,"outside, run"
Exposure sunlight increases serotonine levels. I bought a hand 3D printer and have loads of things with Picking up metal detecting got to go out in nature at least once a week.,1,nature
"(Some stupid things happened as well, but... that's to be expected...). And make look natural. you don't necessarily want approach girls at the beach... you can do it you want; I do it when and where I feel (to a certain degree) comfortable and confident.",2,beach
"And always avoid going to stores, parks etc to avoid people. Anyways I've told anyone I've never been formally diagnosed... find hard to do simple things like taking the dog for walk. been dealing with what is presumed to be social for the past 4-5 ish years and I pretty it stated of was picked on in elementary school. Over the past years really bad, I haven't spoken outside of my months, haven't left the house in and I ultimately can't function properly unless I'm alone in my room.",3,"outside, walk, parks"
"Plus I be long I want, and is nobody in the car park texting me to hurry up. When I personally travel to a location, always go out of way to local museums and historical sites, most people of this generation including girls, don't want to visit such",0,park
"Last week, asked somebody if they had any plans for the Cubs game going to riding off that for a while.",0,riding
"had to miss the first day due to work, but I'll be there early tomorrow and honestly have no clue as to where I'll be up my tent what I'll be doing. I'm not old enough to buy alcohol, so I guess I might as well set up in the sober camp but my plan right now is to settle down wherever there is the highest people.",0,camp
"Best I could give is to start using your mic video to talk to people. Build your with random people in video games and you've developed your skills enough to you're confident then go more! Go on a walk in the park, go the library else to do! bound to strike up converstation with random",1,"outside, walk, park"
"It depends on if you area where getting around on a bike is a viable I’ve heard of people delivering Doordash or Postmates on bicycles but it generally only more viable if you in an urban area where restaurants and delivery addresses closer together, a suburban that is more car-focused it’s difficult. positive with these apps is can accept or reject deliveries and set own house you can’t delivering for a pizza or Johns, but of course the trade off is you make more money for a if deliveries are slow will make you do other around the restaurant, whereas apps can either run multiple once just around between deliveries if it’s slow",2,"bike, bicycle, run "
"god... The worst is when make all go the room in a circle and introduce yourself, a thousand ways and excuses to escape the in the next five minutes through your mind, blinking rapidly, and despair and sickening, tightening in your chest just gets and harder to as knowledge that your is really cements itself into mind. no escaping.",0,run
"the guy hired me said that it possible to extend contract. But in the end, doing right and behaving the manager preferred the who picked fight multiple with one of the coworkers when were playing soccer. Like not bad enough SA, but you have face kinda too.",0,soccer
I a or group of friends that I can go out celebrate with. work in the city and everyone is outside all dressed up and trick or treating or getting ready for the big Halloween parade that goes in the West Village while I’m just sitting in Wendy’s myself rn post and I feel more like a loser after writing that out lol,0,outside
"Big yeah. At work, I to enter from the entrance closest to where I He but I kept from the roundabout way by habit. started parking at the same place but deliberately entering the work from a different angle so I didn't have to past him. Then I had a number of really awkward encounters with a guy whose was mine and the entrance.",0,"park, walk"
most in the world is make a connection with another human but it’s also the most anxiety provoking thing that I run from.,0,run
"At one point, I stopped explaining because my (General Disorder) was triggering. you guys feel the same? I had to run to the toilet so that no sees me breaking down.",0,run
"I know the struggle and it's NOT we choose. If you guy seeing the won't feel so ""on your own"" around a Our brains run the show.",0,run
"Basically my job was riding on and school was riding job. But here I sit math some failed) classes later, and one semester from my electrical engineering degree. I knew I did poorly due to the fact that most were I then had to all way through the school with at red post-crying face that everyone and to car where started crying. I walk on up to the teacher, her my test. She asks me how I think I did. She said she didn't realize, she was sorry math and was hard on me. The also accepted me because of the fact I was working where I was. We had a final test, and I thought I the stuff decently well.",0,"riding, walk"
But know easier long run to push through it and still go to those even if shitty. Getting professional help while you keep up that exposure would be great to do. I'd say most if all the people on this sub will to this.,0,run
"As for playing sports, I was always at basketball so it wasn’t that big of a deal. Edit: Going to the gets you better shape, giving you more confidence I recommend go the gym because really does help. uncomfortable the first few days you’ll eventually realize no there attention to and everyone is doing their own thing. I’ve been going to the gym for 2 months and it’s Just in some headphones and it’ll be like you’re the outside world.",0,"basketball, outside"
"Does ride bus they have seat I just ride for half an staring the blank and trying to focus on others. I live in a big riding bus itself a the ass, but seems have people, I just wait for bus.",0,riding
"Thank you much. It's small thing, is such a of endless daily struggles...",0,stream
"But when I'm with friends and I smoke I always very and have a good time. I also once for dinner with the whole fam I was feeling very drowsy and not active but I brought my filled vaporizer ( dry herb ) with weed. I vaped outside and I was myself again, I was talking my fam and it was I was reborn again. I home I was happy and proud, I later said to my mom what I did when I went outside she I smoke and shes okay with as long as I don't get addicted and she was a bit happy because really saw the diffrence, its not always works like",2,outside
Do the same I do now - take a nice walk in or go metal If didn't have SA possibly could a friend or a partner with me that would be so great - in fact to on a trip with someone a fantasy mine.,1,"walk, nature"
What I supposed to running out people to talk to?. I would go outside but my parents won't me because they it's and when I try talk to people on Facebook almost all of them leave me on seen. I've tried playing games it feels agonizing not to be able with actual people.,2,"running, outside"
"As you may doing a lot cardio gradually muscle mass and that's exactly happened to me. Ever since I still out time to time, but unfortunately I going to the gym. The only workout that I would was running.",2,running
"I think those people were raised in a family that always them that you must do things for the good. think it's natural for someone to do themselves for a (or wife) ideology without having been by outside forces. The most logical is to stay alive, good does it do to change something for the if will be to",0,outside
I'll be making a about my experience with it once have time to give it clear run through and can reflect give my full opinion on it's use for SAD i have heard read can take weeks. i have recently been reading that this stuff can be as effective as klonopin (i call them and ssri's. i literally use to carry fireball and amsterdam vodka shots in my car for emergency situations where i would run into somebody etc.. your comment the yes know and agree with you. thats,0,run
"Also, I'm usually the who receives the deliveries. But honestly, what can say who I see for thirty seconds a pop? I've with all my life (I'm 24) but it's effecting far worse lately. It's incredibly taxing trying to think something to say to them each time, as being totally while I their transaction feels extremely There also a particularly chatty customer base, come in day either their drink of choice or lottery This usually an ordeal, so when I inevitably run out of to say the delivery driver after a minute or two, the rest of the time is an awkward nightmare.",0,run
I just couldn't think of anything say. I literally do not the I will sometimes go the garden but no I'm 23 year man. So I ran outside and back to car. So I moved back home with my mother and have lived as shut-in for almost two years. There need.,2,"garden, outside"
you’re saying is really good advice for things I can control but I’m nervous about walking on stage for my graduation and can’t that.,0,walk
"experiment, develop mastery of fields (creative/fictional writing, directing, cinematography, musical scoring, concept comic art, sound design), get in kinetic (parkour, tricking, fight choreography, stunt performance, bboying, base jumping, wingsuit flying, urban free climbing) basically fuller, wholesome, rich, meaningful, fulfilling, satisfying, connected, present, vivid, visceral, and exhilarating life. have a have fun, date, develop friendships, get involved in a deep relationship.",1,"parkour, climb"
"think I my therapist but here’s the good news. It’s safe to that social anxiety only one of my problems. When my therapist about anger, isolation, history drug abuse I saw a look his face like “oh shit this guy is seriously in need of some help.” There’s a side to this though. I’m to meet with him again two November. goal is to one fear every day for two weeks until my next session. I started today by the campus and meeting who also told how lonely they Nothing major happened but initiated the conversation and broke through the first of the anxiety. didn’t waste any time making the movement I’m bracing for these next two weeks so I can return my with news of improvement. If you’re I know it’s hard as hell out there. When the fear of not facing your fears outweighs the fear that’s when you’ll .find the motivation to change",1,walk
"Ignore the other’s. easy to be company in another’s pain. Solutions aren’t precise and are most certainly unique. I what I do and I get others to do is, I them out of the house and walking and talking. Grocery stores my favorite place do it because you can to look at or about anything besides stressful events that out of your hand. you leave the house, trying cleaning making with your hands. I feel like a mind is more likely if I’m not moving nothing. Hence why I’m not sleep right now lol",0,walk
"Also i wanna join a club so this post definitely me to Congrats, i hope you have lot of fun will see how it",0,basketball
5. I to the once when I have to order so mom/someone does instead I prefer eating outside,0,outside
I like running if you long enough you’ll eventually only to focus on the instead of worrying about everything It helps me head,1,"running, run"
"I personally wouldn’t try online dating but it’s an option. It’s easier than done, trust I know. Join a club, go to the gym, outside more.",1,outside
"I guess it's just the idea of being SO zone. I know I will survive this, but I don't feel like an ""adult"" being alone in a foreign is terrifying me. That being said I feel like I've made - I from never going (ever) to being able to groceries while my mom does something else in the same store.",2,outside
"I know he's normal because I have seen him outside with friends in his he's there, but in school he's not anything, or anything. I think it's social shyness, some extreme form of social shyness, I don't It's this way start of school (2019).",0,outside
