text,label,keyword
"Also, i'm living in home for and i know very neighbors i feel stalked outside, and it's like everyone knows who i am (the complex in a dead-end all the windows make me anxious). later i parked in my street went I barely handle looks while closing the wipers and parking I found someone pulling my windshield wipers up. I heard some honks outside and it made me realize was missing I took my license 3 months ago and i usually drive as safely as i can. made minor mistakes but my impression being has more. Most people in my are not but the looks get walking outside are somewhat the to the anger i feel from some drivers. People rarely get mad me but when it happens (even when unjustified) it saddens me and entirely ruins my So parked bit inclined to the road side than to the (these are small streets and people usually park in the sidewalk) and other car couldn't to the end of the street. The is that can't mistakes that to solved socially and i found it through a terribly expensive experience.",3,"outside, park, walk"
"All audition just stared me the I got so much weird sensations on body. I had to outside for a bit to regain feeling I to keep myself happy, I'm definitely not depressed.",0,outside
"I failed my driver's test last year, I haven't since then, how am I supposed to parallel park? live in a big\(ger\) city now, there's always so many the road, if hit someone? What I make someone angry?",0,park
"(Before they are of something else, not me, now they are) I’m able to go out to places feeling embarrassed, for going to the beach with few and getting in the water. feel so fucking now, I just wanted share I’ve obviously also updated my Instagram pictures.",2,beach
"No one but me has felt my pain or so it. People daily that I think hate don't hate me, if do basing it one don't know and I shouldn't There's no point feeling guilt about are going to find at some point another, our SA will die eventually personal growth or outside help. We might as well be okay with our in the meantime. When I walk my dog, who see me out in public don't know I'm that my really greasy.",2,"walk, outside"
"I get my take pictures of the sunset through my window instead going outside for better shot.. I'm scared my family neighbors will think more of a me go with my camera and pictures of the nice in (Which I do almost everyday) so I take pictures from my bedroom window.nnI for them it's normal seeing the sky, trees, plants they go outside but for someone who never goes out of her house, find these things interesting. n(excuse my eng)",1,trees
He basically explained to that he’s just and had me run through so many things in my mind. His surprised me lot. The mask part is what gives me even more,0,run
"Yes, then I start walking because I forget how I walk start sweating.",0,walk
I also got away from my group of friends a while. There is no one to judge you then. Threw myself in the deep backpacking through another country.,1,backpacking
"At first I was nervous about simply right, I got that. I’m 20 and haven’t really had before, I’m a family run can’t really to college yet personal reasons, I downloaded tinder in hopes to a relationship or at go some dates. Social anxiety keeping from possibly getting gf.",0,run
I believe that going out of house is even if don't have purpose. Just go on a walk to relax. There are periods when I get stuck at for many days in a row and my SA deteriorates significantly.,1,walk
just move on and start connecting more people and eventually you will who you can have a genuine with. you dont have to hit home run with every prove it to yourself you can get up there and take a,0,run
"idk how I still don't feel comfy about it. Funny is that after run, I don't feel that uncomfortable at all. if stop going, I'll be anxious again as if it's the first time, other things like running, I go out of walk path until the beach, feel anxious uncomfortable (3 or 4/10) it's but still bothersome. To me, in ways in others it's more like ups and downs.",3,"running, walk, beach, run"
"I had same problem, I remember when went to college had no friends and I saw guy recognized from camp in the lunch room, I and sat him and his friends but I locked and didn't say anything, I still shudder when I of awkward I was. That summer I worked at a fast food restaurant, I on the register I talk the that was excellent practice, if I feel like talking could just stick to the script (would you like fries with that) if I did feel like talking chat for a bit there order.",2,camp
"My parents weren't like that, they from a young age that i needed an extra push and always tried help me get there. Another thing, is i wonder if as children we are observant and pay attention to when fail and internalize their emotions what happened to them. For me I have a strong suspicion that runs in my family.",0,runs
"And that definitely wouldn't help my mental state. I like if I did I'd be regressing, running back to hide a sense. I back with my mom?",0,running
"my friend was arguably of the worst of my life. this one time really liked this girl and she said she liked me she wanted me to ""make move"" and told cause knew how shy i was and needed to put it out there, we were out and watching a movie i didnt if i should hold her or like do something and was thinking and i felt nauseous and almost threw up her i to run to the bathroom cause she knew and i told her and explained it, a few days after kinda we hung out again i felt confident and bought her her to be my girlfriend and she was like ""ohh my god i cant believe this im so but have to say you're a great guy...blah blah"" took the flowers and texted after and said sorry that she was guy, and we never talked again after talking for about year maybe more.",0,run
"Apart from that though, was good. my first time, I'd say it was a I live in student apartments, so there were some abrupt loud drunk people outside shouting, which a bit off putting.",0,outside
walk home from work pass and i just start walking disoriented.,2,walk
"I remember they give you these wristbands so that you could walk outside to smoke or whatever 10 times, I always used mine up so I had to buy another one, I soon realised that partying wasn't for me. When i was at university i would walk nightclubs drunk I still found my way home, I got reputation of the went missing.",2,"walk, outside"
"Also my literal self image so in my and too focused on my insecurities that I feel like I'm a walking outside. Anyways, I have insane social anxiety, I mean unbelievably insane and doesn't seem to be fixing itself anytime soon, this case since I became a teenager, talking at least 5 of being an guy. When I myself in mirror afterwards I think it's not as bad I thought, and happened countless times insane, now it's everytime I go to the university. When outside I assume everyone is looking all the time and judging me EVERY I make, and if you were looking me sure look like it, it affects my image even I do my to pretend to be confident.",3,"outside, walk"
"I used very bad social anxiety the ages of about 12-16 to **i was to leave the house** or to to anybody but close friends family. nn [Agoraphobia]( an anxiety disorder characterized by symptoms of in situations where the person perceives their to be unsafe with no easy way to escape. These situations can include open spaces, public shopping centers, **or simply outside their i have been having lots of panic attacks and almost daily over stupid irrational things. nnThat is kind extreme. nn&gt; am constantly worrying about think of me and how i across, i have a strong desire to be liked by everyone and can not handle it i am not. nnIt helps think those kinds of as childish.",3,Open Space
"I think you will know best scale you lie, and in what situations might find it useful summarise your experiences as particular situation is social anxiety thing for me' over I'm a kind of antsy and a little bit of motivation the trick'. If you ask a hundred people with SA what like, some will tell you it's crippling their to outside entirely, others will tell you they overall manage function pretty well but in a sore areas it's a real source of distress avoidance. Just because no doubt people exist that struggle far more intensely with SA doesn't mean that people who are more struggles like anxiety, asking the bill, dealing with or presentations, suddenly stop having things difficult distressing.",0,outside
Its okay.. sometimes social anxiety is like that. The last office party went it me to eat and talk so I get it. went outside to get air. I went back in still felt a little odd but the air totally If you still feel super uncomfortable just tell them not well and go home. There will be other parties and sometimes if its much anxiety its good to take a break.,1,Fresh air
"I'm tired of always running to catch attention. It to a certain point. They avoiding me, never asking me stuff, forming groups well fck",0,running
The park ranger job super I'm be a job. Working in a lab sounds cool.,0,park
I feel bad thinking only of have a sister and if she gets I’m afraid she is to ask me be her maid honor and then again I have in front and even do a speech which I honestly I would rather die than that. I’m and never had a and I don’t getting in he very determined/straight because I tend to guys I think like me) so I to worry about,0,walk
"But if I just and TV whilst I’m it makes the so bad, I’ve had some pretty panic whilst high. I also put 432hz and music on and just myself and it’s what come up. I do meditations, but mostly I just do and become a moving meditation practice for me.",1,running
"I'd love to at start taking to another step - just say passing, say something to as am standing by them waiting to cross street, in waiting etc. In passing if I am with them? In work, always make eye contact and smile but I start with them, the anxiety hits my like wall and then usually look away. in my head I I am being a creep by looking and at them when i walk by, I need rid of that mindset. down the street, example, lately I've to walk with my head up, make eye and smile females walk by me although sometimes they'll sometimes look then look away quick, or just look at and look etc.",1,"walk, outside"
"How do I leave a room full of talking coworkers?. in an office, and where I am, everyone near each other on computers work. At the end the day (around 5:30) get up, start socializing. I don't I really know anyone wouldn't have much to anyway. My let me know he was to leave (he got me the job and works in a different of I got to go. Everyone was talking so I to look at phone and act as I got text from him that he was ready to I made eye contact with one of the people I know, and said I was leaving, but my voice probably drowned by everyone talking. So I just out after standing there uncomfortably for 20 seconds. nice to me, so want anyone to I'm by walking out. I don't know how to leave properly. Do I interrupt people while they're talking to tell them leaving? I don't have the voice to just go leaving everyone!"". so quiet most wouldn't notice anyway. Any would be great.",0,walk
Have you tried a therapist? its hard to find the courage all up and stepping outside to but it could,0,outside
You've got anxiety of it's just finally had panic attack. nnnBy the this happens it's good to go outside the college the fresh air can help you calm down and breath easier.,1,Fresh air
"My favorite sport is basketball but been a while since I played lol. Thanks a yes I’m where I’m starting just think more life too stuff but yea appreciate a lot for this Thanks a tho, have a blessed one:thumbs_up_medium-light_skin_tone:",0,basketball
I wish people knew how hard I’m trying.. feel like I’m running just I’m still I had a meeting with my today and he kept about how to improve my communication skills and open up and talk,0,running
"But I have my sides which show I However easy to because over years I've organized my life so that in my day day life I don't encounter that high-anxiety inducing situations. I can go to uni fine, I can presentation in front of small group (anxious, much), I can to people at work, I can go outside on without feeling (only sometimes I do). Just on monday language courses to a place I had never to and I was constantly feeling my heart beating and going 130-140 BPM hours before lesson was about to start, had to walk forth in room and all I could was worry. Now is normal. So I'm betting if they say you at the hospital, then you must have had it.",2,"walk, outside"
"All of my close best friends were separated a different tutor group, is one of the reasons aren’t close anymore. It really hits hard you’ve each for so long. She was really sweet she what a “school mom.” After (beginning of I haven’t made any friends ever since then and what really upsets me is best friend who I had since (for or so) didn’t bother to say goodbye to me my last day and decided walk off along with her new friends. only person my group who I liked was tutor teacher, who would take me alone outside to talk she’d ask me what was wrong and make sure I was okay.",0,"outside, walk"
You gentlemen in thread go to r/NoFap it try.. I’ve given this a try and found while the isn’t completely has reduced by a amount. I went out to park to vlog and to and almost got this girls number. Wouldn’t hurt to it a go but you def have to have some,2,park
the things could do spend time in the area but not entirely walk through the main gate. Best luck the gate and I hope if it’s somewhat you that you yourself to familiarize yourself with hopefully own up to it and your anxiety a good for it! I don’t know is something that you with as well but I’m hoping could help either way for yourself lead somewhat of a easier time and the main gate like any other student would that has a bunch of their own things care about. Seems to me that you to own your in hopes cutting down on the time spent getting to class. Try spend in the close vicinity of the gate and just watch as everyone else has to through there to get to class like they should as it’s the best way to get to class right?,0,"walk, run"
"have for 3 years and my day consists of going my classes and not speaking to anyone and then coming back my dorm to watch schoolwork. I have idea how to get past my fears of to Since I am constantly alone, it has depressed, I sad in my dorm room myself, but I feel when I go outside and see else with their friends/boyfriends having a good",3,outside
"How do we do Two to solve this is either to completely disconnect your inside self like some sort of sociopathic murderer, to unify our outside self, which seems a better solution to me. We want to be exposed as frauds, them to see who we actually are the",0,outside
in the long run neither of them really stay LOL I think I do attract nice people though.,0,run
"Even if I were to overcome my I can't really change the fact that I'm introverted monster. Hmm, I like the idea of running a marathon...or half of one. I really wouldn't know to invite as people in my life aren't on physical activity.",2,running
"I have anyone my age anywhere near where I live so I have to drive into city the time if I wanna meet with friends. I don’t think that’s terrible but I friends. The is there are so obstacles, I live kinda a small city.",0,outside
"At the moment it feels like I've been running a mental marathon the past few days. I can put on brave face and kind BS my through, but about an hour at each of these parties I was totally I can't been having constant anxiety attacks that I've explained away as ""being tired"" (as my don't actually believe that is a thing), and generally feeling wiped out.",0,running
"don't know but writing thoughts magic sometimes. If had ever happened I don't remember. The first time I was outside and a cigarette, when suddenly I realized were running a mile a almost screaming in for no at all.",2,"outside, running"
But when i was off and clean felt Just i thought i ask it perfectly possible though are a real problem but i would that you try more natural before running to the meds.,0,running
can’t ride in public without like staring at me. dare not anyone. Throwing a frisbee in someone I don’t is,3,bike
"I suggested she told she'd prefer a first. we went to grab bite and visited place ice-cream. She had me out, but left it to me to decide the date would be. So we took walk across the park, during up a good rapport.",2,"walk, park"
"BUT, I’ve decided few days I want put a stop to this and try engage in online, and just start having ACTUAL conversations a strangers it is online, gotta start somewhere) and try to learn to drop that “I’m a normal social I I have to every ever, running from it and posts. here’s making an online post I’ve SWORN not to delete (THE ABSOLUTE BOLDNESS). Some this is related to intrusive thoughts (which I go into rn), and not just social anxiety, but the basic gist I isolate myself aggressively everything human interaction",0,running
I spent probably 6 reading soccer forums. like past time at this I watch and read about soccer like I have some really personal in it even never played and know one who plays soccer. Watching and reading about soccer has become like my go to thing pass the if so what are your interests in internet world?,0,soccer
"omg. Im I'm laughing, but I seriously you so At work, I start walking the I see someone toward me or I I idea why I do it. yourself up. kind to yourself!",0,walk
how i downplaying it? i just work and figure out my own problems and recognize that no one help myself but me. social anxiety IS real clinical thing and i feel everyday outside to a point where i physically feel sick sometimes but i don’t blame problems on society or general public.,0,outside
"I don’t think. I was Jordan’s hoodie and sunglasses, im overweight and im just a normal-ass slender 5’10 so why has this me to never foot outside again? It doesn’t feel good being laughed at like Just when I start thinking ‘wow I could really do this regularly’ these girls walk me in the window start laughing, then as they keep looking at keep laughing but bit more this time. I’m sat In greggs getting myself some lunch and decided id make change and eat in. thought I was doing good with my ‘anxiety’ Got laughed by some girls when I was in greggs my Then 5 minutes later walk past the opposite way and do the same thing I was doin actually doing poorly now I wanna never foot outside again, something so",2,"walk, outside"
I post this immense and get 5. post about they are managing to make a call or go outside and get HUNDREDS of Wow.,0,outside
"But stutter just makes me damn quiet. family but my mother is very social and outgoing, I my stutter has me so quiet all my life. Still today with a severe social anxiety and depression I still want to social, fun outside and",2,outside
"I'm near your and have had two jobs thus far. My social anxiety is very crippling, but I need money to make life better in the long run college funds, rent, So here some personal tips: nn1. Volunteer. pet shelters great for this as they accept everyone who willing and not crazy trying skin cats. This will to social environment of and if at a pet shelter you have animals you during stressful moments. Plus you can literally to go whenever you want. For me I week for an or two and I even now. It helps.nn2. Apply for places. Like a fabrics store or garden center. very mello help your anxiety. My was at Walmart in produce section. The worst you'll have deal with is asking you the oranges standing in front of them. don't have work McDonald's boo, you be a recluse and water plants for 6 a day.nn3. You have anxiety like so don't pick up! Let leave voicemail. I got so many when applying my first jobs and never once answered the first time. They would leave a voicemail and I would promptly back within hours a day and give some believable excuse as to why couldn't such as was in school, on the road, personal issue, bad cell service, etc. They'd always to hear would schedule interviews that way. Once you have an interview, their number and wait a call up if can time.nn4. Practice practice practice! Write down possible questions and answers to them. Go over them outloud. Take phone calls in quiet or calm place. common questions and prepare to nervous.nn5. Set your hours low at first and work later in the Go 18 to 20 a week and work from Do NOT, I REPEAT, DON'T you'll hate out of desperation they will you your availability 8am to 10pm Monday to Sunday. Also, pick late or early I.e pick shifts after go to for the to before they get off (9am to 3pm) or after they are usually at home asleep (9pm to early am for me This is a great time work at a store like Walmart, Target, etc. you'll nurses or old women who are looking for in the meat asile. Get know your city's schedule and schedule yourself for times when mass of people are typically busy or 24 hour stores are usually in need of people for these shifts.nn6. Finally, tell them you have anxiety. I have two jobs, but have been over five and have applied 15 places. All of which, I was interviewed, I social anxiety. Employers a bit more sensitive to this. You can ""I have very bad anxiety, and would prefer doing things mostly in back or away from people until I am used work environment to any problems from arising."" They'll usually say ""well we will train you to do x but it takes some time we'll work with you."" That's when they're interested. hide your anxiety someone can affect your future employability. My manager both know how bad I and often coddle when they see it affecting work My fellow employees, though I am not with also understand this and will help me. I work in a pizza place I take orders on register, give answer phones. When step away I ask someone to take over and they will. overwhelmed isn't bad, just take a second to step back.nnSome other tips to remember: for jobs you'll like FIRST, wait a few and then apply for jobs can deal with theoretically. to really go for jobs that match your interests as it'll be easier adjust you denied, don't freak. I did this before it does nothing but take all your hard work. interview again.nnI hope I helped.",1,Garden
I know... You all desires and dreams you can't just be outside let alone there are some full people. The solution is so yet far.,0,outside
I am to even my in my home that is shared by just and my very supportive am afraid to go outside or apply for jobs because I know won't get through the interview and if I do even make it leave the job or get fired because I just showing a loss.,3,outside
"For me, for forcing laughter positivity. Just like swimming against current: your body you to cry, but instead you make it cheeks really hurt afterwards well.",0,swimming
"I just don't find things that Maybe it's my area, I know certain if I lived somewhere else be outside all the time, even my own.",2,outside
"Barely any people outside when its dark so its awesome, rain is the most feel",1,outside
One thing me just get outside and around people going on walks/running around trail. It was terrifying the times but then I realized that no cared that I was there.,1,"outside, walk, running"
"I am worried that this going to follow everywhere since I seem to perfectionistic about I be friends with. am thinking maybe a community. I'm constantly looking for communities I can join which I will feel with. If anyone has dealt with this, it would be great to hear Like I already know I care about run times and stuff so I may feel out of place being surrounded by do care.",2,"running, run"
"Dance, martial arts, cooking, anything. the community out, Take up classes.",2,parkour
"Happiness does not fix much tbh when you stop feeling it for then you finally realise the things that are wrong with did make feel better at the time lol it's not ""pointless"" even if perfect from feeling it. I always ending up wishing I just what I wanted to because then I would be ""confident"" and of this shit be happening. I have it but being other people basically just counteracts it because of anxiety to talk. thought meditating in fucking college toilets the park back a and meditation music would but didn’t. mean I fucking anxious though, even though couple of months ago when I was doing that, I thought it was to be anxious when It really seems to help me temporarily and if I'm at home doing it for some reason.",2,"outside, park"
all my online. That's it. only time I outside is when I'm going to work.,2,outside
"decided to do another one. I went in and talking to the girl that worked about golf, like questions and stuff. went fine and I wasn’t too nervous at So was at the mall and this mini place.",0,golf
"I lot at work and no matter how much I try, never be Running an online business avoid social",0,running
But earlier I just there was a reset in life. I I’m making mountains out of molehills!! I’m worried that weird and ungrateful and won’t bother to offer me rides home the future.,0,mountains
"Could a song you food, an a person, an item of clothing to wear, a place you like to be, doing chores, cleaning, drawing. It would be cool to hear what yours would be. Mine would be swimming, the feel, about the water and the splashing sounds around me.",1,swimming
though I just don't have the to let my consume me like I used left the store and back outside I just getting in my car and leaving 5 years ago I done exactly,0,outside
"For me my smartphone helped a lot. I concluded myself it not something bad, a lesser form of with oneself. I set it up, or hold it while walking and tell it all the thoughts my head.",2,"walk, outside"
