text,label,keyword
"Yes i do, but without drugs, completely i dont think is safe or helpful on the long run at all (sleeping itself). I mean you completely ignore what you are feeling, instead of thinking completely and observing what you are feeling, does that make any sense?",0,run
human_beings I would’ve relieve made an excuse to AN run Man U gotta go. That Shit is rough.,0,run
"I am genuinely interested in who she is, what her name is and so on ( although i do want to bang her hard).but in the moment recreate my go to reaction is the face same as it has always been- just keep your head down and end the interaction as soon as possible. i could tell she wanted me to talk to her , but i just couldn't work up the courage to do it. i started kind of just obsessing over her, when i wasn't at the gym i would experience run through scenarios in my head- like play out what would happen when i went to talk to her and so on ( basically talk to my self, and play out these fantasys in my head). i think this took something that was supposed to be really simple ( just go up to a chick whose checking you out and say hello, introduce yourself) and made it harder than it had to be, i had created this pressure on myself. i want to get to know who she is. im not present in the moment, im reacting and running from it.",0,"run, walk, running"
"18 though and some friends here, but I admirer don’t be_given think they care. I think I might just run too cuz I definitely won’t confront my power parents.",0,run
"I'm not attention starved, just tired of feeling alone. Otherwise, aid I honestly wouldn't even care. Social media and my smartphone are literally my gateways to the outside world, at this point.",0,outside
I ilk feel like you're the older couple who say hi to me on my WHO bike ride to work in the morning. They are take_on nice. They don't say hi back and you know they might be just like you and you accept that.,2,bike
I feel like I'm going to die afterward each time I run the scenario in my head. I still have so much to after that. The bus ride terminated over there is going to be hell lead and the rest isn't going to be much last better.,0,"walk, run"
I think I'll try information_technology it care tomorrow morning. spread I'm hoping like 5-6am. Idk what time sample the park opens though.,2,park
"Even five years later, my automatic reaction was to walk away the moment I thought I heard outside someone and to put on my practiced facial expression as if someone were watching me. Even though I graduated five years ago, I still felt nervous. Even senior_high_school though the school is on winter break and campus was empty, I found myself hesitant to walk where there were usually people. High school was about hiding. I didn't have a single friend in high school in spite of my initial efforts to reach out to people. I joined a soccer team; I quit because of the name-calling. I joined voice lessons; I quit because of the name-calling. I visited my high school on somebody the pretext of seeing the new renovations, but I actually just wanted to feel like I could walk everywhere without fear. high_gear I was still scared to walk around campus, but I made myself do it (albeit there was no one there), telling myself that this is my campus too, that I didn't have to run away and that I have a right to be there. I'm trying to work through some stuff in my own head, so no one needs to read or reply to this.",3,"walk, run, soccer"
Face the girls. single Stay outside college Fukien for 10 min instead of running. Talk 1 min longer.,0,"outside, running"
relieve Bro I'm 6'0 and I weighed 270 pounds (obese) around 248 now but still fat asf and still obese. In the weight room my puffy nipples would poke through my shirt (still does). Still trying to reach my goals I would do the bike machine and my man tits would just jiggle around and people would look.,0,bike
iodine axerophthol I remember being an idiot and only actually running a research paper through call_back an online plagiarism checker AFTER I turned it in. Luckily my teacher saw there was no plagiarism but I was freaking on-line out for a solid weak just waiting for her to confront me.,0,running
"Personally how I ended up with this. Very depressing looking at kids now having a blast outside wandering freely, yelling, just having fun while my childhood summers summer were spent at home isolated, afraid throw of others.",0,outside
"It just happenes, the interviewer smiles, you respond with a smile, this can only happen if you are not anxious or have only whatsoever any type_A negative thoughts running",0,running
"You could, but really, it can mean anything from physical terminal_figure sickness to just feeling really risky bad that day. This is a short term solution though, because it's hard to run from your own family all the time.",0,run
"As for riding I rarely use it since usually if I’m going out taunt with friends at least one of us is not drinking anyways. But it was also really stressful with constantly having to keep volition my car clean and also the anxiety of making a wrong turn and messing up (sometimes my brain will hear left from a GPS even when it said turn right). If I need to Global_Positioning_System use it alone, which is only like 2-3 normally times a year, I’ll usually sit in the back unless the driver offers the front seat.",0,riding
"Dont really adobe have a friend group in after NYC and it sucks, anyone wanna hangout thats around my age sometime? I like video games, hiking, kayaking, woodworking, im starting stamping_ground to learn Adobe After effects for work, movies etc. Tired of being so alone all the time.",1,"hiking, kayak"
"I know it wouldn't be easy or desireable but I think if I were in your position I information_technology would look for some 1 kind of alternative to having a roommate when it seems that bad, or perhaps confront my roommate about iodine it some time and ask if he really hates me or what his problem is. I'm totally shy and really passive, but if someone is really riding me I draw a clear-cut line telling them that this is clock as far as they're going to push me and not any more than that.",0,riding
"Honestly the best way to socialize is to get out and do things. Now condition I'm not saying to go to a party on the spot, just go out, shop, take a walk in the park, that kind of thing. socialise The best way I trained myself to socialize more was going out and shopping.",1,"walk, park"
"I atomic_number_53 just want to pack formerly up incisively and go camping for deficiency a week but I know once I get back it will be exactly like I was never gone and have the same problems. Sorry for the little rant I'm having a pretty shitty day. You're doing great, everything will fall into place, just be a yes man and agree to do anything that comes your way",1,camping
Everyday just try to do something to improve your amend life. Read a book. Take a coiffure walk.,1,walk
"I can’t convince myself that they will forget it by next session, even though I know most people don’t care to remember that type of stuff. I’m the newest player in this group, so I’m already self-conscious about the fact that they have to help me more often than anyone else in the common group. I’ve run through my usual routine only to talk myself out of the anxiety, but it’s not working.",0,run
"I couldn't figure it out and people started to think me annoying for it which led to internal bullying. I've been a big victim of the inside-bullying too. If I said something I thought was funny then people would default to arrogance and assume amp what I was about to say would be stupid and then look at each other laughing at what I said as if they were embarrassed I was trying to make eye contact with them because I wasn't worth talking to. If I started running people would point and laugh because ""you're a nerd and you can't be sporty"". It's a testament to how bad my social skills were and how asocial i was outside of classes but what could I do? Nobody respected me and they obviously talked behind my back because they thought I was annoying or weird or unlikeable and like you've experienced, they also made these strange proclamations of my name in class too and I think the straw that broke the camels back was when I started to realize that when we had to do the ""find someone to be in group with"" stuff people would walk away as soon as I walked over to them even if I had occasionally talked with them before. People would always put me down for ace whatever I did that wasn't academically atomic_number_85 succesful which was at least nice so I had something I was okay at, at the time.",2,"walk, outside, running"
Didn't get courage to pay_up ask for a bag for it so just call_for held it in my hand while biking but still a win! found the thing I needed and paid for it.,2,biking
"Haha I remember making a friend when I was about 12 who’s parents owned a caravan in a caravan park, her family used to go on holiday there quite a lot and she called me up and invited me to come along, I really really didn’t want to, it’s not that I didn’t like her, I just didn’t want to be away from home and her family was a little bit .. weird, I told her I’d go ask my mum if I was allowed, i went to my mum and said my friend had asked me to go stay at the caravan for short the weekend, my mum knows me well, and she said well do you want to go, I shook my head and she said ‘well, no I can’t allow you to go, you’ll have to bid tell her that I said no’ I was pretty thankful lol especially as I’d of felt guilty if I had just lied and said I couldnt go",0,park
"I can't get myself to leave the house unless I have to, I want to get go outside and I might in the summer since I'm planning to get an bmx as a little hobby. Also want to go on music festivals but I've got nobody to bring with set_about me. go_forth",1,outside
"Afterwards I’d over-analyze everything that happened, ego even for days or weeks. I was terrified if I went outside rattling to get the mail that a neighbor would see me and judge me. I wouldn’t go anywhere for weeks for fear of people seeing me. I’d only go grocery shopping at bizarre hours and only use the one self check out because of fear of what the cashier would think of me and my purchases. So how did I climb out…? Very slowly.",2,"outside, climb"
"I'm going through iodine some of the posts you made release but I have to say, those beach photographs were absolutely stunning. 1 Where did you shoot them?",0,beach
Awkward... One word to describe it.... That's just who I am.... I'm 15 and I don't even act like a 15 year old. xv Update: basically was meeting up with a friend and my bf at a library and then we were going to hang out at the park... My friend (wingman) had to atomic_number_85 go so it was unitary just the two of us alone and I was just being...,2,park
"As we are heading back my confidence is already shattered and I'm doing everything in my power not to bawl, I park and all he says to me is go through the exit door and meet him inside. I couldn't bring myself to go inside I was so certain I had completely bombed it and began to have a panic attack I also began to panic because I knew he was waiting for me inside. I got outside and immediately started bawling again I was so shook up about the test, my mom (who thinks I'm just shy) was like why are you crying you passed! I pulled myself together just enough to go back inside; he tells me my total and to sign here (I'm still kinda a mess so I totally didn't process I passed honestly I was waiting for the words ""you passed"") and then I left. I turn nearly bottom out because I was unfamiliar with this off road kind of area and turn back on to the main road. I was sobbing and wanted to go home because I was still so anxious about how awful my test was. I'm left to walk up to the building by myself, the second I get out i of the car I start bawling and shaking.",0,"park, walk, outside"
As long as you're trying most people don't mind and if you're in a football team then you'll probably be training with the team. clump ease If you're not good enough yet you'll just get put on the bench but will still be able to keep getting better whenever attending training and once the people taking hoi_polloi the team think you're ready you can get gametime. Things you can do on your own if you've got a back yard that can help are - Do sprints to one side to another - Practice dribbling - Practice shots educate - Hit a ball off a wall and back and continue to do this,0,bench
"I had no teenager years having fun with friends, I did not finish high school and I’ve not had a type_A job yet. I’m isolated having big problems even taking group_A a short walk one in my neighborhood.",2,walk
Run and don’t function see look back..,0,run
"Im cost so fucking depressed. At school is where most of my anxiety is from, outside at work some of my co-workers (friends) think I’m cause one of the most talkative, funniest, extroverted person they know. I have zero friends at school, all I do really is just sit in my desk till my class is over and just walk to my next class afterwards in a continuing cycle. actually It just makes me grade wonder what I could achieve and what I’ve missed out on the last couple years. Surely, here and there I’ll have days where I talk to people but most of the time I’m just quiet.",0,"walk, outside"
"And exclusive I met way too many people. Well, most days I do nothing but today I had some errands to run and despite feeling positive at the beginning I've managed to embarrass myself in 20 different ways to every single person I've i met today.",0,run
I was just at secondary school (year 9). Then a few years close_to later I went to college (in the UK college is like an extension of secondary school) which is where bravery I did my apprenticeship. My apprenticeship was working at 1 a dog grooming place since I wanted to do something with animals. I mostly wash and dried the dogs. cost The woman just thought I was lacking communication in general and found it weird that I didn’t eat when I was there since I don’t like eating around people. I was thinking about volunteering for dog walking at my local shelter. I rang them a few weeks ago and they said to pop in whenever I want. I just haven’t found the courage to do so.,0,walk
"All throughout school I was severely bullied by a few of so called indium toxic jump_off friends, to the point where I had to leave a few months before my study leave. I plan to temp at some customer service jobs before thinking about jumping back into IT. My worry now is that because my town is so small I believe atomic_number_4 I am going to run in to these bullies at my next job, and the bullying will continue, which would be horrible because I'd probably end up quitting that as well.",0,run
"At this point I was still functional enough to mow the lawn and go to basic places like doctors, dentists, grocery stores, etc. I'll attempt to provide at least a decent example. Then I lost all contact 'tween with supposed friends. Then the outside world completely. Those eventually all stopped and I isolated myself, pretty much professionally if I do say so myself. Version #1, I feel like I have a 2 foot dick just blowing it in the wind as I sit comfortably in my high horse and look down on all the peasants. Version #2, I feel like and_so_on I have a 2 inch soggy day old breadstick from simply Little Caesar's say between my legs and I'm nothing more than the scum of the earth.",2,"outside, lawn, horse"
"All of the above. I love outside but even taking a cost walk around my neighborhood is nervewracking for me. There's always the off chance a man will try to approach me, ask for money or follow something base_on_balls even though I don't have any.",3,"outside, walk"
I also often take a elbow_room walk to a less populated shopping centre nearby and eat at the food court there before going around the shops for a browse. I usually pick the isolated seats in the lecture room and quietly iodin eat and take notes while everyone is focused on the take_the_air lecturer. Other days I eat with my acquaintances in the student rooms.,0,walk
"wherefore I don't know why this happens but I'm romp guessing it's because I used to be bullied. I specifically remember once in gym class I didn't want to play soccer and a classmate screamed ""FAGGOT!"" at me, and some others laughed.",0,soccer
"I’m interested in meeting other people who also have social anxiety since we would understand each other and the anxiety to_each_one would be much less pronounced in a situation like that. I’m a_lot open to doing many things like museums, hikes, stand up comedy, watching movies, etc. Send me a message if you’re interested. anxiousness",2,hikes
"A lot of people my age would find this minuscule since they have explored the world... The only thing I notice is that most people my age are still living at home, apart from current students who moved out deoxyadenosine_monophosphate into dorms or commons shared housing for university. Yesterday, I explored a new business park that is only about 10 minutes from my house and I felt amazed how I explored something new. palpate",0,park
"Does anybody else go through bouts of jealousy too?. Everywhere I look, it seems like somebody younger than me has done more, all because they have some kind of ability to talk or be around other people without libertine any kind of hesitation. I'm a 24yo male, and I just constantly think I'm running out of anxiousness time to accomplish something and the days I waste suffering from anxiety and depression, just makes it seem like time is running faster than ever.",0,running
"All too often, I say no. I DESPISE going outside in urban diagnosing areas. I movement almost hate everyone at school. I cannot make eye contact I hate going outside. I cannot stand densely populated area. I dislike most people at my school I sit at my computer neigh on all day doing stuff I shouldn't be doing I cannot speak in front of people I do not know This one I HATE. I'll just break down my diagnosis into bullet points for the most relevant reckoner things... It's not because I'm lazy; rather fearful of who's outside and who might see me. My parents often ask me if I want to go on a walk with them and the dog. Robot if anyone knows what that is.",3,"outside, walk"
"I mentioned to her how I’ve been really into butterfly gardening lately and how I love helping animals so I was thinking of wording it like this: “I’ve always wanted to help animals my whole life so I guess that taking care of the butterflies kinda counts towards that lol. I’ve been talking to someone for awhile and I’ve asked about their interests and what their favorite things are but I haven’t really asked her what she’s passionate about (like things that they really care about a lot). The one I sent a picture of earlier is actually an endangered species so it’s really cool to have those in my yard” And then from there ask: “So what would you say is something that you’re really passionate about?” We’ve kinda been joking around a lot lately too so maybe after that I’ll say: “Forgive me vocalize if that coquette sounded weird lol, weigh I wasn’t sure how to word it” Do you guys think that sounds okay?",0,gardening
"Sounds like you're extremely highly overthinking the situation unless you're leaving out extra details. Are these girls you've had past interactions with? You said ""I went to comprise the park late so that I dont bump kayoed Park into them"".",0,park
My class got sit_around out early and I’m siting in my ride.been out here in sub freezing U-boat temp for 20 minutes and I’ve got another 25-30 to go. Sitting outside in the cold cuz I can’t bring myself to go back inside.,0,outside
"That’s exactly what we’re doing, eating some icecream while taking a submit walk. And thanks for the great advice, around i should maybe also just take this as sort of a learning experience instead of having all kinds of expectations.",2,walk
angstrom And the more I do this the more socially awkward I get. I could or_else be drinking a beer require in the sun but instead I’m in my room I avoid so many things because I don’t want to be in a situation one where I’m not really wanted there because of my social awkwardness. I hate this constant confusion.,2,"walk, sun"
"As awesome as it was it was a little bit upsetting because this is the end of the year and I wasn't gonna have much of a chance to see her over the summer, but I added her on Facebook and thought that maybe I'd try to make a Washington run at her. I was comfortable. Then I saw she had a boyfriend, another boyfriend.",0,run
"Instead, how about let's be thankful that we still have the rest of our lives to try and turn this situation around? Right? The best time to plant and tree assay was 20 years ago, the 2nd best time is now.",0,tree
"Do you have any hobbies that you enjoy? I've been having a bit of a crappy week, just feeling tired and fed up, so yesterday I when for a longish axerophthol bike ride. It felt good (not like all my worries dropping away, but good).",1,bike
"Anyway, I know this situation too well. Confused, I went over to the only ones left in sight and they were just like ""Oh, don't you have anyone to hang with? We had a school-trip to Copenhagen (I'm cost a dane) in 2013 and I was just in this weird state where I was either very depressed or too passive and before I knew it, everyone was in a group and had run off when we come arrived and had 2 hours to do whatever before meeting later in run_low the day.",0,run
"I always just default to saying ""good how are you"", and she ended up saying ""i'm doing really good"" and honestly just seemed super excited but the conversation kind of just ended since I didn't know what else to say and she was like awkwardly walking backwards back to her desk while tripping and regaining balance on her foot lol. I feel like i might really appear uninterested to her when we talk since I don't say much, and maybe she doesn't like talking to me that much anymore 1 because I may be boring or too quiet or awkward. I'm also literally just trying to time my post-lunch walk right when she finishes lunch so it's like ""oh hey you're going for a walk now too? We also went on an after-lunch walk together and we had a really fun chat (we both just happened to go out walking at the same time). andnbsp; Every time I see her quietly when we walk by like going to the cafeteria, at most I just awkwardly say hi and that's it. good"", and literally overthinking the shit out of the conversations and they always end up not happening. me too no way!!""",2,walk
i've had people literally run the other way the_great_unwashed,0,run
"I was brought up in a pub in England a social place. could say iodin its because i was a kid but i felt like that until i was about 13. but suddenly now at 17 im scared to go to the store so confused? i was apart of soccer teams, belong i would always go outside and i wouldn't care. sound_out",2,"soccer, outside"
Also I am planning to meditate again. I too run regularly for 7 years. Its nice feeling when you remove something from the list to do. Running I dont perceive as a chore.,1,"running, run"
People seem to be afraid of American_Samoa me.. I know it's about me because it happens every time and it really makes no sense because I've never done anything to these people.But what's funny is I've had these same people insult me to my face so clearly there not as scared as they like to act.And I know it's because I don't talk to anybody so they think I'm a freak but they shouldn't jump to the worst conclusion.I neighbour doubt anyone of you can relate so maybe there's something else about me they don't like. Whenever my neighbors see me come out of my house they literally run in the house and if there's kid's out they'll yell at them to go inside.Where I live now two of my neighbors do this and I've had neighbors in the last place I lived do the same.,0,run
I would love to be a one park ranger but I also want to make relieve_oneself a decent salary. I’m planning on going into biology in the hopes of doing research somewhere (hopefully alone) but I have to get through college first I’m planning on it.,0,park
"Currently in college here. nFirst advice don't tell the barber to make it look good. nCome in knowing what type of cut you want or even show them a picture of something you would like that way they know for sure how you want it. Trust me it's not weird.nnI'm stressing over school and work is stressful because I'm a server and my hair is falling out because of it but I'm getting better because I'm trying to take breaks.nnI suggest the same for you maybe take some breaks if you have any hobbies focus more time on those, characterization go for a walk or workout(helps empty my mind and refresh it and keeps me motivated).nnI have learned that your hair doesn't matter typewrite as much as your personality but can make people judge you so if getting a perfect haircut gives lead you that confidence like I said earlier find some pictures off google of reasonable haircuts that you can have and show it to your barber. I don't think it seems weird at all.nnI am two years in my college and have yet to make friends so you are doing fine. It just sounds like you need to get out more besides concerts maybe doing other stuff idk.n",1,Go for a walk
"On my way chalk to an amusement park. Any tips ? I have headphones and sun glasses , I took some cbd oil but I feel a panic attack coming on. why can’t I just be a normal dude . Associate_in_Nursing",0,"park, sun"
