text,label,keyword
At go for a everyday! this thats a and something ive moved past a while so I deffo gone a backwards but its and downs always so im trying to keep positive. So will make it easier and things tying over back allowed and its good your and everyone is out for atm as its the freedom we get isolation so if u doing a few youll have to come across people and at make eye contact say hello to,1,walk
I'm younger than but pretty much the same. It really helps plus there aren't people out. The best way for me get outside is for walks around town late at going out for walk at like 2 AM. You'll enjoy it,1,"outside, walk"
"And i always think i bore other person.. stressed out and dont know what to do fix this... whats my biggest problem? But being rude is better than being girls...idk who to my convos are always dry or boring or bland out of questions to i ask questions like interview and just get a Yes no.. no one cares me or loves me or thinks im important.. im just stupid invisible boring Idk how interested in people, idk how to make friends...im even interested in my self. How do get better at talking people? How do i make people like me? How do i run out things to say? do stop having boring convos that like I hate self.. Idk who am, idk how to who i am, idk how to find out who i want to I only soccer watch movies listen to music. I run of things say. worried so about this.. im worried about what to say My questions are boring hell. These are the things i nothing more... Im not creative or funny or intelligent or charming or cool or smart confindent charismatic James and i have no at all..i have no personality im like a robot..i have no humour or no orginality What talk about everyday and never run things to talk What do i do to people like me???",2,"run, soccer"
"I think the whole Pokemon Go thing. That annoying, luckily for me its more of a track I run so hopefully I won't have issues with and I'm sorry but how did it occur that a lady called a bastard.",2,run
"I anywhere, just bored at all day. Some I'd rather not eat than go to get food.",2,outside
"I am fairly likes back. and seem way outside her league. On the other hand I am really introverted, and good to every word I say, and is the most person I ever met. She seems interested in me, and I have never felt this way about girl She will walk with me to class, study with me every spare block, and she even took my seat Chem class sit beside me.",0,"walk, outside"
"Yeah, have a perfectionistic nature but not something easy to change.",0,nature
world feels so small and the world feels Sometimes it like it won't ever really change. When I'm alone sometimes sad music like but I can't.,0,outside
"has made me change my opinions things. I've always liked now like it there are less outside and I it changes priorities to not go judge and seek shelter, get their car asap etc.",2,outside
A lot of challenging things are easier if are not and can communicate with the world. You are having a race others try to run as fast as they can. on hand will try not trip over or too loud or move,0,run
"I a 20 old guy who never a gf or experience for one in my of college that ended up out through google that I asked but she said maybe and we never went out, I been way too shy shy guy in my big problem is that I can't stop thinking about her one bit throughout the day, always this feeling top center of my where it feels like a dent in not much pain but this sharp tingling feeling. I really on anything else, I just have thoughts about with hanging out, eating taking long walks together holding hugging, at the theater, sitting inside together relaxing, or that she is just with me wherever I am. I'm really ready to into so thats not what I care for a girl.",0,walk
"""Of I have friends, they just can't come over. They have that. You know that thing where are, like, allergic to the",0,sun
Bob Marley thinks you deserve it: He says don‘t worry about a thing 'Cause every little thing gonna be alright Rise up this mornin' with the risin' sun Three little birds Pitch by my doorstep Singin' sweet songs Of melodies pure and true is my to you) Singing' don't worry 'bout a thing 'Cause every little thing gonna alright,0,sun
"soon as I her if I hang our poster nearby, she replied in nasty and judgemental tone. I the desk and asked where I could hang our poster, had else who appeared be charge so I assumed that the women the awareness booth would be kind and help no, this woman did made it difficult for to talk people around two days. thought I overreacted, but I assure her tone was not ""I'm going help this person find out where to go"" it was ""how DARE you speak to me"" it just messed with me, felt like I did wrong when all I did was ask to help me club where and now talking it has made freshly upset... Tl;dr a woman running domestic violence awareness was rude and spiteful to me because tried to her I could hang my poster when my club was forced relocate for a night Our club took place the they were using, and had not been informed of so we had make a sign to hang up to tell our members where to go, this became my job. Think?""",0,running
"(Please don't do this, get help) I worked the hardest I've ever worked to get to uni (because I failed so units last time, it was hard slog), and having achieved what been an impossible task through the perseverance I'd had in I got back into my studying I really love and got accepted to live at a residential college that's super to get into because it's so But he also rarely says hi to me, when he passes me directly on way to class (and know for a fact he me), but maybe I've brought this on myself those two where I retreated into my shell. He takes up so much space in my head and I wonder sometimes if is just running course. doubt take up any space in but I a chronic overthinker, and this has me for weeks. talked to my Mum friends about this but sometimes an perspective can help these kinds things. It was so bad I lived in constant fear of going insane and ending in a had an fear of convinced I'd kill whether accidentally not. Last year I somehow managed to myself out of the shit, drug and without any outside help, from best friend and my Mum. This is long as shit but I need some serious help. seriously make my year.",0,"outside, cruise, walk, running"
"get reflux and from tomato coffee liquor things I love). If I go outside especially in the and its or windy, my eyes water. addition to this, no matter allergy I take or what I drip water from my nose eyes.",2,"outside, walk"
"Around 7 ready to At this I've just scanning the subreddit for situations similar mine, frantically clicking post post while the adrenaline surges through my like But let me tell you that in that heart stopped, and then sank to an unfathomably place. I ask him if I should drive down there and park and meet them somewhere he's like yeah that works. I didn't even bother texting my feel as if could vomit. I find the spot where I'm going to park miss the turn so I've go down and take next I know it... What the fuck."" I looked I watched the cars going and the lights, and heard music from a club or a somewhere. park my car. actually WORSE if I completely bail and sit around at home in my thoughts. Later on he texts me saying the plan to chill and walk the strip since this girl is from SoCal wants to see the at night. anxiety is bubbling up me. So I said fuck it I'll think it and text after work disclosing that wailing fucking pit of fear just opened in stomach). This is too much to handle all at once.",0,"walk, park, outside"
I can be funny and speak clearly while streaming. I stream in spare time.,0,stream
"get on your high horse just because he pulls out the ""I have mental illnesses and I'm sad boohoo"" card. I'm not going to support that. We all shit to deal with, to play the after insulting others.",0,horse
I was at a basketball game with my dad and a few of my who i’ve known years so i am just wanted to share this front of lot people. stadium isn’t that big and the seats were pretty empty... my dad a shooting competition a timeout and asked i wanted do tl;dr: had to do a basketball g a infront a mediocre crowd and kind of lost control over my and or body freaked out after because the embarrassment.,0,basketball
As that stop playing the sport my anxiety so that wasn't really same until recently (now I had basketball around your as outlet that in hindsight I believe really prevent my social anxiety from coming out too strong. Lol relate to lot.,0,basketball
And I’ve stayed behind confidence. And sometimes even against the wall I’ve created and listen to world just to hear what I’m missing. I’ve become incapable of big picture in life.,0,outside
"About ago, I ended up waking up at 5:10am. Freaked but was in work 5:30am - I practically flew down there (it's usually a 15 minute walk) for late then offered to stay to the missed time. It went down much better than if I'd rang said coming in (in they laughed it off, saying that everyone does it 'cause of the hours).",2,walk
"If you with him just because of your although I know seems like the best way to rid of your stress right now, I think you'll regret it, see in the that it only things worse. It was a year I started to as a good decision. same thing will in from now until the of time, unless you find way to trust him and talk him",0,run
"wouldn's say overcome it completely yet but feel much now compared to how a year ago where I left my all by myself. I like to think of these things like challenges/experiments. example, if you're afraid of around the streets by yourself, start off walking the neighbourhood you still feel slightly anxious, but a safer, and doing until you feel like anymore then go for bigger things, if you've got phone anxiety then dial strangers purpose and stupid then you've got the wrong number and hang up. If wanna talk to a group of around people for example, expressing there's only people for example. You baby steps. also tried to neutralize my thoughts. an anxious thought would suddenly occur about an upcoming event, I would try myself down and say something ""Maybe, it won't as bad think, maybe I'll do better time, it be that ""I've done before I know it again, I certainly won't die!"" Mantras as ""I am completely independent of the good and bad opinions of others"" in my also help. ""Haters gonna hate"", ""I be myself, and if someone me it, then their problem, not mine"". ""I am just important as anyone else is."", etc.. Sometimes if I fail and up awkward or anxious I just try pick myself up, dust myself off and for at least trying, telling myself that next time I'll do better because I that as keep trying and moving on, and day when that last restriction of my life melts away, I will finally reach my goal I'll be happy, anxiety free and live life always wanted. I also meditate to a clear mind. I personally think it helps us to reinforce the statements I mentioned above easily into our minds. for the crappy",1,walk
"Sure, most of the time I get a feeling that I'm not part of society. Everywhere outside go it seems like people pushing me out of Really me down.",2,outside
"I social and me super uncomfortable when my little sister’s boyfriend sleep in bed the room next to me.. I (20F) have social I have no friends, let alone had a boyfriend and my sister (17) has everything I never had. In she started dating guy (17 also) and he lives like an house (I back in with my parents, brother sister from university when this covid thing happened). Because he lives of far away, he sleeps here for a couple of nights and my sister sleeps there for of nights too. my sister on the couch he would sleep her in the morning she would go back her The firsts couple of times slept over, I would hear in the middle of the night get up and go her (my didn’t know she was doing that) when doing that, would wake me by walking past my I had a hard time falling back asleep. happened five times before I decided to to her about When I talking to I like was scared that I would tell our parents, which I didn’t, but she asked my mom to to me about it she didn’t understand what was waking me up. She told our mom I was probably waking up at midnight would go room to the couch. Because she decided to go to that, I told her (our mom) that it at 3 or 4 in the morning and sometimes I couldn’t even fall So after my mom had all the information, I she my sister because for month after that she would always on the at least in the But the he was they slept her bed all night, together, for the two nights he was here. don’t think parents know. know she’s 17 and her boyfriend is really sweet, but it makes me soooo uncomfortable. even had sleeping at night during those two nights because I knew they were sleeping in the same bed, in the to me. Today, I went into to get something (I had her permission) and saw started taking control. me uncomfortable. I replaying the I heard in the middle of night like the bed moving and things like that making up scenarios... So I know is: should I tell my mom that it makes me they in same bed? I don’t know if my mom and sister talked and my mom told her ok for them to sleep in the same bed and I want to make things awkward. think I would have talk to my mom it if sister hadn’t to her in the first place.. The main reason it me because I never had a boyfriend and I always thought should be example for my siblings because I am the oldest, but clearly I at that because my her life way more figured out than me. What should I What would you if made you that uncomfortable?",0,walk
somehow i dont even want to get outside or talk i dont get anything positive from interacting with others and all those negatives i feel like im better off alone.,2,outside
"That was my wish too. Up until I began developing suicidal I didn't even know I a whole boatload of issues, and me being of everyone was a legitimate disorder. In therapy, I saw the what it was. wish you the in therapy!",0,boat
"Easier said than done. For me personally, not running gives me anxiety.",1,running
"I can be walking hear people laughing and I immediately worry if laughing at me. I hate being like this. Obviously, this was silly but these thoughts have intrusive since.",3,"walk, outside"
Cash Me Outside Bout Dah I had the worst attendance my school ever.,0,outside
"Like read a few of a book, clean your bathroom, or take a walk. You start small. and#x200B;",1,walk
sure you start running scenarios your head on how you could've pulled that better.,0,running
"Life is a mix of good days and bad Trust me, you will have really good days in your life, though the feel it, you have to have rain for the sun to come out.",0,sun
"I'll branch out to bunch stuff, but large majority of my playlist is some form of punk. I'm really into the whole fuzz sound now, stuff like FIDLAR and Wavves.",0,beach
"I recently seeing a support she's helped with going outside more. So, this last month I've been making more of effort to improve things hopefully this is the of me becoming more socially comfortable. This all lead why I'm making today... we've been exploring my local area I'm getting walking and just generally being outside.",1,"outside, walk"
"If don't know him well it's probably best to have few conversations to give him a to get to know you and him. Don't label as a date or anything, just ask if wants meet you it can progress there if you guys click. When feel like your friendly enough maybe ask if he wants to do something after",2,outside
"But I've really thought about it to honest, kind on a ""when it comes it comes"" also comes side of potentially making the worse which isn't a big deal but it is that worries me a little. But it does questions if I won't be able to outside which is to make it hard to go to my and to actually get I think that's the point I'd say I don't about the side effects because even if comes to worse nobody will care about it anyway and I won't hurt anyone.",0,outside
"I a OLD people. No way man. i went the park (pokestop, lure and gyms there) and omg, there old people, teens, college kids, moms with their",2,park
You might relaxed not having to but trust humans are social creatures and in the long run you’re going become miserable from that feeling wanting to be alone is the main bridge from social anxiety to depression.,0,run
"Anyway! I'd also like to be able to talk to people a, calmer my conversational skills and such. I've been partying a times but it turns out, incredibly expensive hobby long run and not exactly swimming",0,"run, swim, climb"
And I knew one day would end but know My gf and I broke up 15 months bc I working anymore. made everything bc she was line to the world.,0,outside
"For my we are glued the phones, we would rather stay in our rooms on our computers/tv than go outside socialise. idea of natural conversation has completely disappeared only exists alcohol and pick-ups coincide (clubs, The old would always chat about and yes would be awkward sometimes always to get along.",0,outside
"But he's the only ""door"" to the outside world i so i just can't let go of him... I feel i've lost sympathy for only since 8th grade at least since 2 years...",0,outside
"A walk to a park just coffee shop. If presence of your classmates in this relation is causing much anxiety knows everyone and would drag mabey try asking out to something simple. a hard terrifying jump of cliff, but I think if you manage to to her in a safer enviroment (other than school) gossip, your nerves calmn down.",1,"walk, park"
So do dry run of your presentation and plan what you will exactly Trying to causes a lot anxiety for us if we ahead of,0,run
I’m deffo of an person now with bad social anxiety come to terms that’s I’m at atm. My friends told me that they also this way for like month after we all had a Parts of old are deffo there but they are very hidden I accepted in in for the long run in terms of getting bette.,0,run
"hear what you're saying, and that basketball player is something like me. I want to reach absolute top.",0,basketball
"Alone but lonely.... But strangely I rather alone than company and okay... Does anyone else walks alone, and feel okay about it? I'm currently alone right at the beach after taking a long walk. I'm really anxious I out at place like the beach.",1,"beach,  walk, beach"
"???? I literally running I barely see them or anyone store is not that big) and when I see them they are just filling stocks together adding tags. Or is something right? Some costumers even said ""oh wow are you all alone?"" Tonight asked me remove everything from when we were close usually people together) while doing the checkout and filling the stocks while they were in the back doing ?",0,"outside, running"
"To buy it a store is scary, the scariest is get outside and walk to the in the middle of a place.",3,"outside, walk"
My anxiety also miraculously transformed into an unbreakable I anything in without shame and no longer even care about being judged (eg. People think I'm some kind of incredibly unshakable person who can remain calm even in most dire situations. wearing totally inappropriate clothing outside and not even being able to care about people staring at me) When someone me or taunts I am physically incapable of being affected by usually response is to laugh off.,0,outside
Everyone were so shy that it made so uncomfortable that I took and led the conversation. picked weeds at a local park other students from my university.,2,park
"It'll be easier to stay calm when just go 'ah, yeah I'm gonna a bit bumbly here but fuckit, it doesn't matter in the long run and it's anyone who to make fun is a douche anyway'. It's that this is for you, give yourself to breathe and work this and improve overtime. Try not think as some kind or deal.",0,run
":( I've been thinking about doing online but then I worry too much about leaving friends, not having anyone to socialize with, and a whole lot other worries. And now on academic probation, so I play soccer this year. and#x200B; Anyway, I've just been a lil stressed about",2,soccer
After biting the bullet and doing it I realized it wasn’t so bad. I got specifically for out of paying the cashier directly. One day I my card and running on fumes so had no choice.,0,running
"Go fuck yourself. What, you me to say, ""Yes, remember you your dying day, so you should just stay inside and never go die alone""? You never have asked the question if you're afraid scary answers, dick.",0,outside
"It's the resting bitch face syndrome. And there is no absolute for beauty, so may say you're ugly, but other people may find you attractive/beautiful your own way. Most have thing as they not focused on their outside but on inside and their thoughts.",0,outside
"This like the thing I can ever give advice on Go to interviews for places were really want the job. I know it dumb, if you have the time it's a great to do a run and a bit of a confidence booster. Keep doing this until you can manage your anxiety/body little time.",0,run
"But I am more awake and my brain is running there is less overthinking I have more energy my and speak I don’t know how of 100% true, this is experience and I’ve found. If I’m hanging out with a group, for example, I’m tired, I’ll tend to and I won’t really say things come to my",0,running
"suffered from it since I was 15, I understand how debilitating be to just go outside and the fear before just doing the simplest of tasks can make you feel. I this post because, I know this subreddit tends be mainly memes and jokes, and I love it we do all share one thing we all suffer social anxiety. Social anxiety an awful mental disorder.",3,outside
"I feel like I completely on uni and now I a full time 9-6 where I can't wait to run home and be alone. I myself today that yesterday was a huge step for I'm 23 and had social and bpd since was 19. It makes really sad and every time I push myself to hang with people I end becoming Just keep giving yourself small, consistent :) you not alone! Today challenging go to park with a friend I haven't in a while and chat.",1,"run, park"
"My thought waves are green, but pretty much.",0,waves
Sitting at the while crush is a romantic hike her bf.. I hate day so much.,0,hike
"And that taking time for yourself too, just running from one event to another. Just do your best. One at time.",0,running
"Go. Funerals are pretty easy, you up, maybe say to your colleague and sit down for the ceremony. Trust me, as someone who had to a double funeral last year (for dad and grandma died six weeks other), you don’t what anyone else does but you notice if they show up or not.",0,run
If i knew to drive i in crowd anyways. The worst part is i don't want to do something anymore. They go outside do everyday.,0,outside
I can't wait till it cools down outside since my AC went out this summer. Driving around my windows down somehow me that *everyone is staring* vibe.,0,outside
Certainly looks like I feel this I have been for presentation the past weeks in the end feels absolutely in success in life. I've climbed a pebble yet there is mountain still ahead of me. Whether after I climb the mountain there'll be an one still.,0,"climb, mountain"
One day in school I to of them in offhand way that they shouldn't wear specific shirt it revealing. They have group hangs and do activities without me such hiking or doing a 5k. of thing happens often the following weeks.,0,hiking
"Everytime I tried to make friends they used and then bullied me verbally and mentally until 13 I quit going to and outside completely. Internet specifically MMOs is all I've had since. So, that's some backstory, and ever since then I have an recluse.",2,"outside, walk"
"I haven't got a clue to start asking for and I'm wondering if of can me this. I've living social anxiety for of my life up this point been trying to with it myself and with as little outside help as possible, I've decided that this approach isn't working for as my social anxiety is worse and so I've decided that I need to get help. Where/how to get help?.",0,outside
"am a 20 year old male, and I've had a horrible anxiety with other mental problems for years now. had a 1 year period where didnt what to do with and didnt much conversations with outside people. I thought therapy I probably handle situations but I was wrong, today I was and I horrible anxiety time had with a person.",0,outside
"And the part I felt comfortable with it. Having conversations about everything under sun and loving it. No feeling sick to stomach, no",0,"walk, sun"
And then after meet the next guy I legit don’t even think about the past for another second again and it’s just stupid can’t. BUT it even worse. gets even worse because the last guy who I met one year ago at an outside day party in college when I was drunk it was fine first day bc was basically blacked but then he started snapping me a few days later asked me to hang out and I literally couldn’t even though I straight think sorta liked him (honestly did but always tell myself I didnt myself) and definitely bc when to him I kept obsessing with him the entire year beat myself up over it I so much.,0,outside
"I'm 19 through two very labour intensive jobs (maintenance engineer, Industrial boiler work) which I quit because I was treat awful because I dont talk work much so I guess I fit in with colleagues this friction upon my last job with my foreman who to be the managers son who was as bad as school at 16, wanted to leave since my first year..... (12years old), all I saying was going to pass cause I'm stupid...so why try?. doesn't mean I child"" infact quite the I just stayed quite a word unless it was my two close friends I them dinner, if friends weren't at any day I not able to anything at dinner just wanted to run home instead I stayed at school nearly the",0,run
