text,label,keyword
"Coincidentally we also didn't live round around any other kids; the school bus didn't even come to our house. My parents weren't narcissistic or religious nuts, maybe a bit overprotective, but I feel like the rules they had for me prevented me from making friends in my early development, which is of course a very important time to make friends. My parents would still force me to go outside sometimes when they felt I had spent too much time on the computer (no internet of course), even though there was literally nothing for me to do except maybe throw a frisbee at my brother who course_of_instruction is four years younger than me (a huge age difference for a preteen).",2,outside
"What about hobbies? Everyone has hobbies, wether it is binging TV series, kip_down or playing video playacting games, or reading books, gormandise or biking, or going to concerts, ... I would imagine you opine dont just get up, drink a coffee and then lie down on your bed all day until you actually fall asleep until the next day to repeat this cycle.",0,biking
"All the time, and the feeling remains till this day. ), I serving probably wouldn't be here typing this today. I have dysthymia as well and if it wasn't for my fearful nature (fear actually helping somewhat here!",0,nature
"My mom would wonder say ""What's the worst that can happen if you go outside and explore?"" find bechance Our SA brains know perfectly spoilt well how to answer that question - a lot could happen!",0,outside
"I didn't want to have to rely on meds to live a fulfilling life, and I felt confident enough in myself that I could handle any returning anxiety on my own going forward--or that I was at least willing to try--so I said ""that's it, medication held my anxiousness hand and walked my partway up information_technology the mountain, but now I'm ready to tackle the rest of it myself."" I leave guess it was sort of like being intoxicated. I was so much more confident and hopeful in the future, and in my own abilities, that I kind of forgot that wasn't the true me, or at least the normal me.",0,"walk, mountain"
"Life has a strong current, but those who swim upstream are the strongest. You have to make an attempt to progress in life, in any way, or else you will feel stuck in a rut, motionless, dull, and hopeless.",0,swim
I think I'm just going to throw myself in the deep end to learn to swim ya know? If I let other people excuse my behaviour because it's uncomfortable for me(because it is incredibly hard for me to put myself out there and I'm sure you know what I'm embody talking about) then I won't ever learn to be better.,0,swim
"Also pointing the camera at me because apparently it's ""fun filming the shy dude"" is making me mad. I touch took a walk at the park with some friends the other day and almost every group we met along the way was filming themselves (or taking pics) and consequently filming people passing by (us). If people stopped filming everything everywhere, a lot of us would feel more comfortable going outside. Is this actually a sharpen common thing? Is this bothering anyone else?",2,"outside, walk, park"
"Also, nearly joining extracurricular activities natural_action like yoga classes, connect sewing classes, running clubs and other stuff can be helpful. Facebook groups for common interests. I can say for me, where I work I manage to make friends with most of the people I work with. I haven't hung out with any of them outside work, but I feel like I can talk with them and i can say that we are friends. So if you can find work somewhere, even a grocery store... flavor you might find people there who you like being around and a friendship can bloom.",2,"outside, running"
"I'm so sorry for you being scolded for being more with the guys, it's not right at all to do such thing to a kid (or anybody) for talking more to one sex rather than the other. My anxiety towards the same sex started when I was at school, guys would laugh at me, call me names and do that sort of things because I didn't like sports or wasn't attracted to newly girls (only as friends, my best friend at the time, and only friend, was a girl). Now whenever I meet a new guy I joke feel like I'm going to be DO extremely judged and I just black out and enter fight or flight mode (but mainly it is a *FLIGHT, RUN THE FUCK OUt of here* mode).",0,run
"It's paranoia, seeing things outlook that aren't there, having negative expectations with absolutely no basis, and making mountains out of molehills. Realising that the anxiety is pointless, unimportant noise is an important part of realising equal there's nothing to fear and that ingest it's worth taking chances. Social anxiety causes distortions, plain and simple, it's not a truth detector or even close to it.",0,mountains
"I should move on, because I do want to be friends with wish her. Like, I don't think she is BSing me about it. Trust me, I've run over that thought for months now.",0,run
I also got away from my group of friends for a while. There is no pack one to through_and_through judge receive you then. Threw myself in the deep by backpacking through another country.,1,backpacking
I have an update by the way. I asked her if she could hit me up when she's not busy and she says that when basketball season is over (since she's on the college team) she'll have more more_than free time! This is pretty good.,0,basketball
"At least go out for a walk everyday! But this is somethign thats a basic task and something ive moved past a while ago, so I had deffo gone a bit backwards but its ups and downs always so im trying to keep positive. So that will make it easier and keep things tying over till we go back to normal. its allowed and its good for your mind, and everyone is out for walks atm as its the only freedom we get during isolation so if u keep doing that a few times youll have to come across people and at least make give_way eye contact and say hello to them.",1,walk
"I'm younger than you, but we're pretty much the same. It really helps plus there aren't many people out. The best way lately for me to get outside is going for walks around town late at night. Try going out for a walk at like 2 AM. You'll enjoy it",1,"outside, walk"
"And i always think i bore other person.. Im stressed out and dont really know what to do to fix this... whats my biggest problem? But being rude is better than being nice to girls...idk who to be. But my convos are always dry or boring or bland or i run out unity of interesting questions to ask.. i ask questions like an interview and most times just get a Yes or no.. no one cares about me or loves me or thinks im important.. im just a stupid invisible boring nice guy.. Idk how to be interested in people, idk how to make friends...im not even interested in my self. How do i get better at talking to people? How do i make people like me/value me? How do i never run out of things to say? How do i stop having boring convos that are like interviews? I hate my self.. Idk who i am, idk how to realize who i am, idk how to find out who i want to be? I only play soccer watch movies and listen to music. I run out of things to say. Im worried so much about this.. im worried about what to say next. My questions are boring as hell. These are the 3 things i do nothing more... Im not creative or funny or intelligent or charming or cool or smart or confindent or charismatic like James bond.. im worthless and i have no qualities at all..i have no personality im like a robot..i have no humour or no orginality in me. What do couples talk about everyday and no_more never run out of things to talk about?? What do i do to make people like me???",2,"run, soccer"
"Omg I IT didn't think about the whole Pokemon Go thing. That would be so annoying, luckily for me its more of a track where I run so hopefully I won't have issues with that. and lol, I'm sorry but how did it occur that a lady called running_play you a bastard.",2,run
"I don't really go exhaust anywhere, just bored at home sooner all day. Some days I'd rather not eat than sooner go outside to get food.",2,outside
"I am fairly certain she likes me back. I’m not athletic and seem way outside her league. On the other hand I am really introverted, and fairly good looking. She listens to every word I say, and is the most caring person I have ever met. She seems interested in me, and I have never felt this way about a girl before. She will walk with me to class, study with me every spare bailiwick block, and she even took my friends seat in Chem class to sit beside me.",0,"walk, outside"
"Yeah, definitely have a only decidedly perfectionistic nature but that’s not something that’s easy to change. leisurely",0,nature
My world feels so small and the outside world feels better. Sometimes it feels like it won't ever really euphony look change. When I'm alone I sometimes listen to sad music and I feel like crying but I can't.,0,outside
"SA has precedency made me change my opinions on things. I've always liked rain, but now I like it because there are less people outside and I imagine it changes or_else people's priorities to not go judge people at_present and instead seek shelter, get inside their car asap etc.",2,outside
A lot of challenging things are easier if you are not stressed and can communicate with the world. You are having a race and others will try to run as fast as they can. You on the other hand will try not to adenine trip over or breathe too loud or move funny. firm,0,run
"I am a 20 year old guy who never had a gf before or experience except for one in my freshman year of college that i ended up finding out through google that she was 32, I asked her out but she said maybe and we never went out, I always been way too shy (voted as most shy guy in my HS yearbook) The big problem is that I can't stop thinking about her one bit throughout the day, I always have this headache like feeling in the top center birth of my head where it feels like a dent in my skull, not much pain but this sharp WHO tingling feeling. I can't really concentrate on anything else, I just have thoughts about being with her, hanging out, eating at a restaurant, taking long walks together holding hands, hugging, at the theater, sitting inside near together relaxing, or that she is just with me wherever I am. I'm not really ready to jump into sex so thats not what I care for in a girl.",0,walk
"""Of course I have friends, they just can't come deliver over. They ace have that. You know that thing where people are, like, allergic to the sun?",0,sun
"Bob Marley thinks you deserve it: He says don‘t worry about a thing 'Cause every little thing gonna be alright Rise up this mornin' Smiled with the risin' sun Three little upward birds Pitch by my doorstep threshold Singin' sweet songs Of melodies pure and true Saying', (this is my message to you) Singing' don't worry 'bout a thing 'Cause every little thing gonna be alright",0,sun
"As soon as I asked her if I could hang our poster somewhere nearby, she replied in an incredibly nasty and judgemental tone. I politely approached the desk and asked where I could hang our poster, I had not seen anyone else who appeared to be in charge so I assumed that the women running the awareness booth would at least be kind and help me... no, what this woman did made it difficult for me to talk to people for around two days. Now I thought perhaps I overreacted, but I assure you, her tone was not ""I'm going to help this person find out where to go"" it was ""how DARE you speak to me"" and it just messed with me, I felt like I did everything wrong when all I did was ask someone to help me ensure non my club mates knew where to go... and now talking about it has made me freshly upset... Tl;dr a woman running a domestic violence awareness booth was rude and spiteful to me because I tried to ask her where I could hang one my poster when my club was forced to relocate for a night Our club took place in the room they were using, and we had not been informed ahead of time so we had to make a sign to hang up to tell our members where to go, this became my job. Think?""",0,running
"(Please don't do this, get help) I studied and worked finally the hardest I've ever worked to get back to uni (because I failed so many units last time, it was hard slog), and having achieved what should've been an impossible task through the most perseverance I'd had in years, I got back into my dream school, studying what I really love and got accepted to live at a residential college that's super hard to get into because it's so popular. But he also rarely ever says hi to me, even when he passes me directly on the way to class (and I know for a about fact he sees me), but maybe I've brought this on myself during those two weeks where I retreated back into my shell. He takes up so much space in my head and I wonder sometimes if this is just anxiety running it's course. I doubt I take up any space in his, but I am a chronic punishing overthinker, and this has bothered me for weeks. I've talked to my Mum and friends about this but sometimes an outside perspective can really help with these kinds of things. It was so bad I lived in constant fear of going insane and ending up in a madhouse, had an intense fear of meds and was convinced I'd kill myself, whether accidentally or not. Last year I somehow managed to pull myself out of the shit, drug free and without any outside help, aside from my best friend and my Mum. This is long as shit but I need some serious help. You'd merely seriously make my year.",0,"outside, cruise, walk, running"
"I get horn_in acid reflux and heartburn pry from tomato sauce, coffee and liquor (all things I love). If I go outside especially in the morning, and its sunny love_apple or windy, my eyes water. In addition to this, no matter what allergy medicine I take or what dose, I drip water from my nose and eyes.",2,"outside, walk"
"Around 7 I get ready to go. At this point I've just been scanning the SA subreddit for situations similar to mine, frantically clicking from post to ane post while the adrenaline surges through my veins like fucking hot lava. But let me tell you that in that moment my heart stopped, and then sank to an unfathomably low place. I ask him if I should just drive down there and park and meet them somewhere and he's like yeah that works. I didn't even bother texting my friend. I feel as if I could vomit. I find the spot where I'm going to park and miss the turn so I've got to go down and take the next right. I know it... What the fuck."" I looked outside, and I watched beat the cars going by, and the flashing lights, and heard music playing from a club or a bar somewhere. I park my car. I'll actually feel WORSE if I just completely bail out and sit around at home in my thoughts. Later on he texts me green saying the plan is just to chill and precisely walk the strip since this other girl is visiting from SoCal and just wants to see the city at night. My anxiety is bubbling up inside of me. So I said fuck it I'll think about it and text you after work (not disclosing that a wailing fucking pit of fear just opened in my stomach). This is too much to handle all at once.",0,"walk, park, outside"
nip I can be funny and can speak clearly while streaming. I stream on good_story twitch nip in my spare risible time.,0,stream
"Don't get on your gymnastic_horse high horse just because he pulls out dupe the ""I have mental illnesses and I'm sad boohoo"" card. I'm not passing going to support that. We all have shit to deal with, no need to play the victim after insulting others.",0,horse
I was at a basketball game with gage my dad and a few of my teammates who i’ve known for many years so i am comfortable. i just wanted to share this experience. in front of a lot of people. this stadium isn’t that big and the seats were pretty empty... my dad was invited to do a shooting competition during a timeout and he asked if i wanted to boastfully do it. tl;dr: had to do a basketball shootout durei g a timeout infront a mediocre crowd and kind of lost control over my precious skills and or body and freaked out after because of the embarrassment.,0,basketball
As that I stop lately playing give the sport my anxiety grew so bad that I wasn't really the same until recently (now 22). I had basketball at around your age as an outlet that in hindsight I believe really helped prevent my social anxiety from coming more_or_less out too strong. Lol I relate to this a lot.,0,basketball
And I’ve stayed behind it with confidence. And sometimes I even lean against the wall I’ve created and listen to the outside world just to hear what I’m missing. I’ve become incapable IN of seeing 1 the big picture in life.,0,outside
"About 2 weeks ago, I ended up waking up at 5:10am. Freaked out but was in work by 5:30am - I practically flew down there (it's usually a 15 minute walk) choke and apologised for being late then offered to stay longer to make up the missed time. It went down much better than if I'd rang down_feather and said I'm not coming in at all (in fact, they almost freak laughed it off, saying that everyone does it 'cause of the hours).",2,walk
"If you break up with him just because of your anxiety, although I know it seems like the best way to undecomposed get rid of your verbalise stress right now, I think you'll regret it, and see in the long run that it only made things worse. It was a year before I take_a_leak started to think of it as purely a good decision. The same thing will happen in every relationship from now until the end of time, unless you find a way to trust him and talk to him about your fears.",0,run
"I wouldn's say I've overcome it completely yet but I do feel much better now compared to how I was a year ago where I barely left my house all by myself. I like to think of these things like challenges/experiments. For example, if you're afraid of walking around the streets by yourself, start off by walking around the neighbourhood where you still feel slightly anxious, but a lot safer, and continue doing that until you feel like there's no threat anymore then go for bigger things, if you've got phone anxiety then dial strangers on purpose and act stupid then say you've got the wrong number and hang up. If wanna talk freely to a group of around 6 people for example, try expressing yourself when there's only 2 people for example. You know, baby steps. I also tried to neutralize my anxious thoughts. If an anxious thought would suddenly occur about an upcoming event, I would try to calm myself down and say something like ""Maybe, it won't be as bad as I think, maybe I'll do better this time, it can't be that bad."", ""I've done this before and I know I'll do it again, I certainly won't die!"" Mantras such as ""I am completely independent of the good and bad opinions of the others"" in my opinion also help. ""Haters gonna hate"", ""I can only be myself, and if someone doesn't like me finger for it, then it's their problem, not mine"". use ""I am just as important as anyone else is."", etc.. Sometimes if I fail and end up being awkward or ane anxious I just try to pick myself up, dust myself off and congratulate myself for at least trying, telling myself that maybe next time I'll do better because I know that as long as I keep trying and moving on, and some day when that last restriction of my life melts away, I will finally reach my goal where I'll be happy, anxiety free and live the life I've always wanted. P.S. I also meditate daily to keep a clear mind. I personally think it helps us to reinforce the positive statements I mentioned above more easily into our minds. Apologies for the crappy English.",1,walk
"Sure, most of the time I information_technology get a feeling that I'm not even part of the society. Everywhere outside I go it seems like people are pushing me out of there. Really drags me down.",2,outside
"I have social anxiety and it makes me super uncomfortable when my little sister’s boyfriend and her sleep in the same bed in the room next to me.. I (20F) have social anxiety, I have no friends, let nighttime alone had a boyfriend and my sister (17) has everything I never had. In February she started dating this guy (17 also) and he lives like an hour away from my house (I moved back in with my parents, brother and sister from university when this covid thing happened). Because he lives kind of far away, he sleeps here for a couple of nights and then my sister sleeps there for a couple of nights too. Usually, my sister slept on the couch and he would sleep in her room and in the morning she would go back in her room. The firsts couple of times he slept over, I would hear her awaken in the middle of the night get up and go to her room (my parents didn’t know she was doing that) and when doing that, she would wake me by walking past my room and I had a hard time falling back asleep. That happened about five times before I decided to talk to her about it. When I was talking to her, I felt like she was scared that I would tell our parents, which I didn’t, but she asked my mom to talk to me about it because she didn’t understand what was waking me up. She told our mom that I was probably waking up at midnight when she would go from her room to the couch. Because she decided to go to our mom about that, I told her (our mom) that it was at 3 or 4 in the morning and sometimes I couldn’t even fall back asleep. So after my mom had all the information, I guess she talked to my sister because for like a month after that she would always stay on the couch until at least 8 in the morning. But the last time he was here, they slept in her bed all night, together, for the two nights he was here. I don’t think my parents know. I know she’s 17 and her boyfriend is really sweet, but it makes me soooo uncomfortable. I even had trouble sleeping at night during those two nights because I knew they were sleeping in the same bed, in the room next to me. Today, I went into her room to get something (I had her permission) and I saw that she started taking birth control. That made me even more uncomfortable. I just kept replaying the sounds I heard in the middle of the night like the bed moving and things like that as making up scenarios... So what I want to know is: should I tell my mom that it makes me uncomfortable when they sleep in the same bed? I don’t know if my mom and my sister talked and my mom told her it was ok for them to sleep in the same bed and I don’t want to make things awkward. Honestly, I don’t think I would have talk to my mom about it if my sister hadn’t talk to her in the first place.. The main reason it makes me uncomfortable is because I never had a boyfriend and I always thought I should be an example for my siblings because I am the oldest, but clearly I failed at that because my sister has her life way more figured out than me. What should I do? What would you do if it made you that uncomfortable?",0,walk
somehow i dont even want to get outside or talk 1 to people... i dont get anything see positive from interacting with others and after all those negatives experiences i feel afterward like im better off alone.,2,outside
"That was my wish too. Up until I began developing suicidal ideation I didn't even know I had a whole boatload of wishing issues, and that me being literally afraid of i everyone was a legitimate disorder. In therapy, I saw the monster for get what it was. I wish you all the best in therapy!",0,boat
"Easier More said than More done. For me personally, not running gives me far More more anxiety.",1,running
"I can be interest walking outside and hear people laughing and I immediately worry if they're laughing at me. I hate being like this. Obviously, this instantly was silly but these thoughts have tooshie become more intrusive since. rich_person",3,"walk, outside"
Cash Me attending attending Outside How Bout attending Dah I had the worst attendance in my school ever.,0,outside
"Like read a few pages of a book, clean your bathroom, or take a walk. You bug_out start small. and#x200B;",1,walk
trusted fly_the_coop I'm sure you start running scenarios in your head on how you could've pulled Indiana that better.,0,running
"Life is a solar_day mix rainwater of good days and bad days. pelting Trust me, you will have really good days in your life, even though most the time it doesnt feel it, you will. You have to have rain for the sun to come out.",0,sun
"I'll branch out to a bunch outgrowth of different stuff, but dissimilar the large majority of my playlist is some form of punk. I'm really into the whole beach fuzz sound right now, stuff like FIDLAR and Wavves.",0,beach
"I recently started seeing a support worker and she's helped me with going outside more. So, this last month I've been making more of an effort to improve things and hopefully this is the start of me becoming more socially comfortable. This has all lead up to why I'm making this post today... Together victimized we've been exploring my local area and I'm getting used to walking around and just generally being outside.",1,"outside, walk"
"If you don't know him very well it's probably best to have a few conversations to give him a chance to get to know you and you him. Don't label it as a date or anything, just ask if he wants to belike meet you extraneous then it can progress from there if you guys click. When you feel like your friendly enough maybe ask if he wants to do something outside or after school.",2,outside
